{"run":146,"commit":"da59769","metric":914626.073,"metrics":{"ttt_empty_ns":1309083.042,"ttt_mid_ns":300288.906,"uttt_empty_ns":1033380.55,"uttt_mid_ns":947975.6,"deep_chain_ns":3757475.708,"wide_512_ns":404577.156,"uttt_rollout_ns":4195.015,"uttt_step_ns":10.737},"status":"discard","description":"Visit expansion actions without temporary vectors","timestamp":1785194316051,"segment":4,"confidence":8.007052044537746,"asi":{"hypothesis":"A default State action visitor with bundled fixed-mask overrides can eliminate legal-action Vec allocation from every expansion while preserving order and external compatibility.","finding":"TTT mid regressed 5.0%, UTTT 3.5-4.5%, and primary 2.2%; only TTT empty was flat. Closure/visitor inlining and larger expansion code outweigh small action-vector allocations.","rollback_reason":"Primary and most end-to-end searches regressed.","next_action_hint":"Keep compact get_legal_actions vectors for expansion; callback-based allocation avoidance harms codegen."}}
{"run":147,"commit":"da59769","metric":905452.232,"metrics":{"ttt_empty_ns":1312979.292,"ttt_mid_ns":288048.359,"uttt_empty_ns":1028211.1,"uttt_mid_ns":949010.1,"deep_chain_ns":3773472.333,"wide_512_ns":395708.781,"uttt_rollout_ns":4230.364,"uttt_step_ns":19.262},"status":"discard","description":"Confirm current direct-construction best without code changes","timestamp":1785194350689,"segment":4,"confidence":7.920948315561848,"asi":{"hypothesis":"An unchanged run after several reverted prototypes should verify the direct-construction baseline remains stable.","finding":"TTT and tree metrics remained near the kept result; UTTT sampled 2.9% slower, moving aggregate 1.1%. Direct-construction gains versus its pre-change baseline remain large.","rollback_reason":"No code change and primary did not beat the kept sample.","next_action_hint":"Treat roughly 1% aggregate shifts cautiously; require targeted structural gains."}}
{"run":148,"commit":"93094d7","metric":858955.15,"metrics":{"ttt_empty_ns":1270112.958,"ttt_mid_ns":236122.297,"uttt_empty_ns":990813.9,"uttt_mid_ns":912802.35,"deep_chain_ns":3703695.833,"wide_512_ns":399796.906,"uttt_rollout_ns":4123.469,"uttt_step_ns":18.202},"status":"keep","description":"Share immutable UCB lookup tables across searches","timestamp":1785194712198,"segment":4,"confidence":8.87631176639505,"asi":{"hypothesis":"Applications and full games construct many Mcts instances at repeated budgets; process-wide immutable power-of-two table tiers can pay inverse-sqrt/sqrt-log setup once while each search keeps a direct static slice hot path.","finding":"Primary improved 4.07%; TTT empty/mid improved 2.9%/17.5%, UTTT about 1%, with tree workloads flat. Full checks pass.","mechanism":"Cold OnceLock+Mutex maps build each table tier once, leak the immutable boxed slice intentionally for process lifetime, and return branch-free static slices. Hot UCB formulas and rounding are unchanged.","tradeoff":"First use may build up to the next power-of-two (at most 2x exact work); retained tiers consume geometrically bounded process-lifetime memory. Test exact-size sharing next to reduce one-off cost.","next_action_hint":"Compare exact required-size shared tables; prefer them if repeated-budget gains persist without power-of-two overbuild."}}
{"run":149,"commit":"93094d7","metric":862436.488,"metrics":{"ttt_empty_ns":1259703.458,"ttt_mid_ns":237008.531,"uttt_empty_ns":1010974.75,"uttt_mid_ns":929304.25,"deep_chain_ns":3715581.583,"wide_512_ns":394825.688,"uttt_rollout_ns":4126.89,"uttt_step_ns":12.575},"status":"discard","description":"Share exact-size UCB lookup tables","timestamp":1785194740458,"segment":4,"confidence":8.745892518022579,"asi":{"hypothesis":"Keying shared tables by exact required length should preserve repeated-budget reuse while avoiding power-of-two first-use overbuild.","finding":"Primary regressed 0.4% and UTTT about 2%; TTT/wide were mixed. Exact sizes also risk retaining a new leaked table for every incremental search total rather than geometrically bounded tiers.","rollback_reason":"Primary did not improve and exact-size lifetime memory behavior is materially worse for repeated incremental searches.","next_action_hint":"Keep power-of-two shared tiers; at most 2x first-use work buys bounded geometric growth and broader reuse."}}
{"run":150,"commit":"93094d7","metric":875709.652,"metrics":{"ttt_empty_ns":1305984,"ttt_mid_ns":239529.312,"uttt_empty_ns":1013108.7,"uttt_mid_ns":939956.7,"deep_chain_ns":3771506.708,"wide_512_ns":401407.531,"uttt_rollout_ns":4290.307,"uttt_step_ns":11.018},"status":"discard","description":"Store shared UCB tiers in fixed OnceLock arrays","timestamp":1785194798895,"segment":4,"confidence":8.581087062069784,"asi":{"hypothesis":"Fixed power-of-two OnceLock arrays can remove cold Mutex/HashMap lookup, own tier boxes without leaks, and retain direct static slices.","finding":"Every end-to-end search regressed 1.5-3.0% and primary 2.0%; tree workloads were near flat. Larger tier dispatch/static initialization code or table placement is worse than the compact out-of-line map path.","rollback_reason":"Primary and all end-to-end workloads regressed.","next_action_hint":"Keep cold Mutex/HashMap tier lookup; its lock is paid only at table acquisition and leaked immutable slices give better hot layout."}}
{"run":151,"commit":"93094d7","metric":875324.447,"metrics":{"ttt_empty_ns":1317110.625,"ttt_mid_ns":240537.094,"uttt_empty_ns":1014064.25,"uttt_mid_ns":932535.3,"deep_chain_ns":3743475.625,"wide_512_ns":401055.312,"uttt_rollout_ns":4088.141,"uttt_step_ns":18.487},"status":"discard","description":"Confirm shared UCB lookup tiers without code changes","timestamp":1785194885293,"segment":4,"confidence":8.13952039376889,"asi":{"hypothesis":"An unchanged rerun should confirm that shared lookup tiers improve repeated Mcts construction beyond the unusually strong first sample.","finding":"Primary remained 2.2% better than the pre-share best; TTT mid retained a 16% gain and full-game Criterion independently improved TTT 1.9%. This sample was 1.9% above the already-kept run due normal UTTT/TTT-empty drift.","rollback_reason":"No code change and sample did not beat the kept measurement.","next_action_hint":"Retain shared power-of-two tiers; gains are robust though the first 4.1% aggregate sample was optimistic."}}
{"run":152,"commit":"93094d7","metric":870397.918,"metrics":{"ttt_empty_ns":1318643.083,"ttt_mid_ns":240637.891,"uttt_empty_ns":1005720.3,"uttt_mid_ns":925539.8,"deep_chain_ns":3719372.458,"wide_512_ns":395798.188,"uttt_rollout_ns":4131.641,"uttt_step_ns":11.428},"status":"discard","description":"Index shared UCB tiers in a compact vector","timestamp":1785194949285,"segment":4,"confidence":7.741174074686992,"asi":{"hypothesis":"A mutex-protected vector indexed by power-of-two tier can avoid HashMap hashing/random state while retaining compact cold dispatch and leaked static slices.","finding":"Versus the immediate hash-map confirmation, primary improved about 0.6% and most non-TTT metrics 0.6-1.3%, but it remained 1.3% above the kept best sample. Signal is below current drift and does not justify changing the established registry.","rollback_reason":"Primary did not beat the kept implementation; sub-noise registry cleanup is not enough.","next_action_hint":"Keep HashMap registry unless a broader full-game/paired study establishes vector tiers; focus on hot paths."}}
{"run":153,"commit":"93094d7","metric":879799.499,"metrics":{"ttt_empty_ns":1333528.833,"ttt_mid_ns":240358.375,"uttt_empty_ns":1024126.15,"uttt_mid_ns":935870.25,"deep_chain_ns":3705281.333,"wide_512_ns":407427.469,"uttt_rollout_ns":4076.507,"uttt_step_ns":15.366},"status":"discard","description":"Reconfirm vector-indexed shared UCB tiers","timestamp":1785195025653,"segment":4,"confidence":7.118709612340362,"asi":{"hypothesis":"A second vector-tier run can determine whether its prior 0.6% paired gain over HashMap was real despite missing the optimistic kept sample.","finding":"Primary was 0.5% worse than the immediate HashMap confirmation and 2.4% above the kept run; end-to-end metrics were mostly worse. The prior vector result was noise.","rollback_reason":"Primary did not improve and repeated evidence no longer supports vector registry.","next_action_hint":"Keep HashMap tiers conclusively; stop iterating cold registry representations."}}
{"run":154,"commit":"93094d7","metric":874750.011,"metrics":{"ttt_empty_ns":1310324.875,"ttt_mid_ns":237552.922,"uttt_empty_ns":1040951.1,"uttt_mid_ns":927785.75,"deep_chain_ns":3755943.917,"wide_512_ns":396795.969,"uttt_rollout_ns":4125.143,"uttt_step_ns":17.264},"status":"discard","description":"Reserve exact TTT legal-action capacity","timestamp":1785195070158,"segment":4,"confidence":6.588899084084472,"asi":{"hypothesis":"TTT's empty-mask count can size each expansion action vector exactly, reducing late-tree allocation class/footprint while preserving the fixed-loop action order.","finding":"Targeted TTT improved about 0.5-1.2% versus the immediate HashMap confirmation, but unrelated UTTT empty regressed 2.7%, leaving primary 1.8% above the optimistic kept best.","rollback_reason":"Primary did not improve; targeted gain needs confirmation without unrelated UTTT drift.","next_action_hint":"Reapply once and keep only if TTT gains repeat strongly enough to improve aggregate."}}
{"run":155,"commit":"9d3268c","metric":866173.55,"metrics":{"ttt_empty_ns":1267875.125,"ttt_mid_ns":237828.688,"uttt_empty_ns":1005386.3,"uttt_mid_ns":927724.25,"deep_chain_ns":3718279.208,"wide_512_ns":403826.594,"uttt_rollout_ns":4187.005,"uttt_step_ns":10.42},"status":"keep","description":"Reserve TTT legal actions to exact empty count","timestamp":1785195102356,"segment":4,"confidence":6.4566327986776795,"asi":{"hypothesis":"TTT's existing empty-mask lookup can choose the exact action-vector allocation size while retaining its proven fixed-loop emission order.","finding":"Confirmation improved TTT empty 3.7% and mid 1.1% versus the unchanged shared-tier baseline; aggregate improved about 1.0% versus that paired baseline, though it remained above an unusually low prior sample. First run also improved both TTT targets.","mechanism":"Late expansions allocate only 1-8 action slots instead of always 9; no action ordering or contents change.","next_action_hint":"Retain based on repeated paired TTT gains; avoid rank-table generation, which was previously rejected."}}
{"run":156,"commit":"783b636","metric":861419.425,"metrics":{"ttt_empty_ns":1272285.083,"ttt_mid_ns":237639.469,"uttt_empty_ns":990255.9,"uttt_mid_ns":910862.9,"deep_chain_ns":3731275.75,"wide_512_ns":401538.469,"uttt_rollout_ns":4185.933,"uttt_step_ns":11.411},"status":"keep","description":"Reserve UTTT legal actions to exact available count","timestamp":1785195142087,"segment":4,"confidence":6.487784135455892,"asi":{"hypothesis":"UTTT already computes a forced-board empty mask and maintains global occupancy, so both legal-action vector paths can reserve their exact final length instead of 9/81 slots.","finding":"Primary improved 0.55% versus the paired prior code; UTTT empty/mid improved 1.5%/1.8%, with other core metrics within about 0.6%. Full checks pass.","mechanism":"Forced vectors use bit_count(empty); unrestricted vectors use 81-occupied. Contents and ascending action order are unchanged.","next_action_hint":"Retain exact bundled action capacities; allocator sizing now matches immutable child-list sizing."}}
{"run":157,"commit":"783b636","metric":872911.594,"metrics":{"ttt_empty_ns":1293330.792,"ttt_mid_ns":240895.078,"uttt_empty_ns":1019923.2,"uttt_mid_ns":933895.25,"deep_chain_ns":3802012,"wide_512_ns":392107.281,"uttt_rollout_ns":4166.922,"uttt_step_ns":16.056},"status":"discard","description":"Dereference copied child IDs directly","timestamp":1785195186280,"segment":4,"confidence":6.664918568961148,"asi":{"hypothesis":"Replacing Clone::clone on &usize with explicit dereferences can remove trait-call expression overhead in per-iteration child choice and final selection.","finding":"All core metrics except wide regressed 1.6-2.6%, primary 1.3%. LLVM already erases Copy clone; source-expression/layout differences favor the existing form.","rollback_reason":"Primary and most core workloads regressed.","next_action_hint":"Keep clone-on-Copy despite Clippy style warning; suppress that lint during finalization rather than changing hot code."}}
{"run":158,"commit":"783b636","metric":0,"metrics":{"ttt_empty_ns":0,"ttt_mid_ns":0,"uttt_empty_ns":0,"uttt_mid_ns":0,"deep_chain_ns":0,"wide_512_ns":0,"uttt_rollout_ns":0,"uttt_step_ns":0},"status":"crash","description":"Pack mask-rank coordinates into u64 rows","timestamp":1785195260992,"segment":4,"confidence":6.664918568961148,"asi":{"hypothesis":"Packing nine four-bit coordinate codes into one u64 per empty mask can shrink the rank table 4.5->4 KiB and replace multiply-by-nine addressing with scale-eight plus variable shift.","finding":"Benchmark panicked because shifted packed rows were cast without masking the low nibble, allowing subsequent rank bits into coordinates.","rollback_reason":"Trivial missing 0xF mask caused invalid TTT positions before measurement.","next_action_hint":"Reapply with `((packed >> shift) & 0xF) as u8`; table construction and concept remain valid."}}
{"run":159,"commit":"783b636","metric":873435.071,"metrics":{"ttt_empty_ns":1277955.458,"ttt_mid_ns":249836.281,"uttt_empty_ns":1006154.3,"uttt_mid_ns":925797.3,"deep_chain_ns":3747896.5,"wide_512_ns":398331.312,"uttt_rollout_ns":4207.559,"uttt_step_ns":10.446},"status":"discard","description":"Pack mask-rank coordinates into u64 rows","timestamp":1785195294359,"segment":4,"confidence":6.816966242243186,"asi":{"hypothesis":"Packing each mask's coordinate ranks into one u64 shrinks the table 11% and replaces multiply-by-nine byte addressing with aligned scale-eight plus a variable nibble shift.","finding":"TTT mid regressed 5.1%, UTTT 1.6%, and primary 1.4%. Variable shifts/masking and wider loads outweigh modest footprint/alignment savings.","rollback_reason":"Primary and targeted game searches regressed.","next_action_hint":"Keep direct byte-per-rank table; its single indexed byte load is superior to bit-packed decoding."}}
{"run":160,"commit":"783b636","metric":871123.539,"metrics":{"ttt_empty_ns":1286862.5,"ttt_mid_ns":240760.703,"uttt_empty_ns":1022512.75,"uttt_mid_ns":936951.75,"deep_chain_ns":3732527.875,"wide_512_ns":394431.625,"uttt_rollout_ns":4186.802,"uttt_step_ns":11.107},"status":"discard","description":"Align mask-rank coordinate table to cache lines","timestamp":1785195323060,"segment":4,"confidence":6.363181702650159,"asi":{"hypothesis":"The 4.5 KiB byte table is currently placed at an odd address; 64-byte alignment can eliminate one spanned cache line and make random row loads cleaner.","finding":"All game searches regressed 1.4-3.2%, primary 1.1%; only unrelated wide improved. Linker/data placement changes and alignment padding are worse than unaligned byte loads.","rollback_reason":"Primary and targeted selector workloads regressed.","next_action_hint":"Leave compact lookup constants at natural alignment; modern unaligned byte access is not the bottleneck."}}
{"run":161,"commit":"783b636","metric":870895.168,"metrics":{"ttt_empty_ns":1282070.042,"ttt_mid_ns":240308.219,"uttt_empty_ns":1001705.85,"uttt_mid_ns":918238.35,"deep_chain_ns":3791560.875,"wide_512_ns":406070.312,"uttt_rollout_ns":4226.895,"uttt_step_ns":10.428},"status":"discard","description":"Capture inverse-root slice directly in UCB scorer","timestamp":1785195357674,"segment":4,"confidence":5.966040669223822,"asi":{"hypothesis":"Copying the shared inverse-root slice into a local before creating the score closure may make its pointer/length loop-invariant and avoid repeated field/alias loads.","finding":"Primary regressed 1.1%; TTT, UTTT, deep, and wide were all 0.8-1.8% slower. LLVM's direct self-field capture gives better register/layout choices.","rollback_reason":"Primary and all core workloads regressed.","next_action_hint":"Keep direct self.inverse_sqrt capture; no manual hoist is needed."}}
{"run":162,"commit":"783b636","metric":868393.898,"metrics":{"ttt_empty_ns":1274902.167,"ttt_mid_ns":239607.906,"uttt_empty_ns":1005265.85,"uttt_mid_ns":929997.8,"deep_chain_ns":3798654.125,"wide_512_ns":395302.875,"uttt_rollout_ns":4174.223,"uttt_step_ns":15.298},"status":"discard","description":"Emit TTT legal actions by empty-bit iteration","timestamp":1785195391243,"segment":4,"confidence":5.506195570086994,"asi":{"hypothesis":"With exact capacity already known, trailing-zero iteration can emit only empty TTT cells and remove the fixed loop's nine occupancy branches while preserving ascending order.","finding":"TTT empty/mid regressed 0.2%/0.8%, deep 1.8%, and primary 0.8%. For nine cells the fixed predictable loop remains cheaper than trailing-zero/clear-bit dependencies.","rollback_reason":"Primary and targeted TTT workloads did not improve.","next_action_hint":"Keep fixed nine-position TTT legal-action emission with exact allocation capacity."}}
{"run":163,"commit":"3cdcb31","metric":815726.141,"metrics":{"ttt_empty_ns":1285816.667,"ttt_mid_ns":248925.969,"uttt_empty_ns":981904.95,"uttt_mid_ns":908013.45,"deep_chain_ns":3776549.708,"wide_512_ns":273375.812,"uttt_rollout_ns":4202.429,"uttt_step_ns":14.371},"status":"keep","description":"Return the last unvisited child before UCB scoring","timestamp":1785195439546,"segment":4,"confidence":6.375604419142157,"asi":{"hypothesis":"Fresh sibling sets contain unvisited children whose UCB scores are all infinity; when the first remains unvisited, directly returning the last unvisited child preserves last-equal semantics and skips floating scoring during initial coverage.","finding":"Primary improved 5.3% versus current code; wide-512 improved 31.9%, UTTT about 1%. TTT regressed 1.1-4.7% and deep 1.2% from the extra guard, but the structural wide gain is dominant. Full checks pass.","correctness":"If child zero is unvisited, reverse search returns the exact last infinity-scored child the sequential comparator would select, even if public mutation creates holes. Otherwise the unchanged UCB scan handles all layouts.","next_action_hint":"Confirm and explore a width threshold so narrow TTT scans avoid the guard while wide trees retain the large gain."}}
{"run":164,"commit":"12dc0ab","metric":815660.627,"metrics":{"ttt_empty_ns":1284045.042,"ttt_mid_ns":241315.234,"uttt_empty_ns":1008568.3,"uttt_mid_ns":932839.8,"deep_chain_ns":3696987.25,"wide_512_ns":273232.062,"uttt_rollout_ns":4127.728,"uttt_step_ns":15.359},"status":"keep","description":"Limit unvisited-child shortcut to branching width 16+","timestamp":1785195474758,"segment":4,"confidence":6.251871210460764,"asi":{"hypothesis":"A width-16 cost threshold should avoid paying the unvisited guard on narrow TTT scans while preserving its structural wide-tree advantage.","finding":"Primary was fractionally better; TTT mid recovered 3.1% and deep 2.1%, wide held, but UTTT regressed 2.7% because many useful shortcut sites are narrower than 16.","next_action_hint":"Test threshold 8 to retain UTTT/root and medium branching while skipping the narrowest late-game TTT scans."}}
