{"run":60,"commit":"76ac66f","metric":130349.569,"metrics":{"ttt_empty_ns":1417373.917,"ttt_mid_ns":299071.062,"uttt_empty_ns":1366386.8,"uttt_mid_ns":1257154.05,"deep_chain_ns":5023398.083,"wide_512_ns":527200.719,"uttt_rollout_ns":4030.487,"uttt_step_ns":10.723},"status":"keep","description":"Store immutable child lists in a two-word boxed slice","timestamp":1785187894887,"segment":1,"confidence":7.005310000098998,"asi":{"hypothesis":"A node's children are assigned once at expansion and never mutated afterward, so a 16-byte boxed slice can replace the 24-byte Vec, eliminate spare capacity, and shrink hot arena stride.","result":"Primary improved 0.44%; TTT empty improved 3.6%, UTTT searches 1.6-1.8%, and deep-chain 6.1%. TTT mid and wide regressed 1-3%, but most real searches and the cache-stress case improved.","mechanism":"Children are created as one contiguous range after the expansion batch and boxed at exact length. Node stride drops by 8 bytes; read APIs used by tests remain available through Deref/IntoIterator/as_slice.","tradeoff":"The public `children` field changes from `Vec<usize>` to `Children`, a source-level API narrowing for callers that mutate child lists directly. Search behavior and all tests are preserved; this is justified by the write-once tree invariant and cache-locality goal."}}
{"run":61,"commit":"76ac66f","metric":142467.803,"metrics":{"ttt_empty_ns":1562858.083,"ttt_mid_ns":546199.234,"uttt_empty_ns":1356221.65,"uttt_mid_ns":1230731.95,"deep_chain_ns":5010707.583,"wide_512_ns":568028.469,"uttt_rollout_ns":4013.301,"uttt_step_ns":10.428},"status":"discard","description":"Use direct numeric comparisons in UCB maxima","timestamp":1785187957254,"segment":1,"confidence":7.673079955872681,"asi":{"hypothesis":"Valid UCB scores are non-NaN, so `>=` should preserve last-equal tie handling while compiling to fewer floating comparison branches than partial_cmp+unwrap.","finding":"TTT midgame regressed 83%, empty 10%, wide 7.7%, and primary 9.3%, despite UTTT improving 1-2%. Tiny comparison/codegen differences materially alter stochastic tree trajectories/tie handling in TTT.","rollback_reason":"Primary and TTT search behavior/performance regressed catastrophically; direct comparison also drops the existing NaN panic contract.","next_action_hint":"Preserve partial_cmp+unwrap exactly in both public and cached UCB scans."}}
{"run":62,"commit":"57a782f","metric":127685.247,"metrics":{"ttt_empty_ns":1425159.458,"ttt_mid_ns":296770.562,"uttt_empty_ns":1413060.25,"uttt_mid_ns":1289668.1,"deep_chain_ns":4107222.333,"wide_512_ns":513660.406,"uttt_rollout_ns":4045.16,"uttt_step_ns":10.741},"status":"keep","description":"Store single-child lists inline without heap allocation","timestamp":1785188048910,"segment":1,"confidence":8.860789994702625,"asi":{"hypothesis":"Many narrow/late tree nodes have exactly one child; tagging that ID into the existing two-word Children storage can remove their heap allocation without increasing Node stride.","result":"Primary improved 2.0%; deep-chain improved 18.2% and wide 2.6%. TTT empty improved slightly, while UTTT and TTT mid regressed 2-3%.","mechanism":"Children stores empty/single IDs inline and uses a thin boxed-slice pointer plus length only for 2+ children. Slice/iteration APIs are preserved and one-child pointer chasing disappears.","unsafe_invariants":"For len<=1, as_slice borrows the aligned inline data field. For len>1, data is exclusively produced by Box::into_raw and reconstructed exactly once in Drop with the stored length. Children is immutable after assignment. Full tests pass."}}
{"run":63,"commit":"57a782f","metric":0,"metrics":{"ttt_empty_ns":0,"ttt_mid_ns":0,"uttt_empty_ns":0,"uttt_mid_ns":0,"deep_chain_ns":0,"wide_512_ns":0,"uttt_rollout_ns":0,"uttt_step_ns":0},"status":"crash","description":"Use explicit exposed-provenance APIs for compact child pointers","timestamp":1785188085522,"segment":1,"confidence":8.860789994702625,"asi":{"hypothesis":"Explicit pointer provenance exposure/reconstruction makes the tagged two-word Children representation robust under Rust's strict provenance model without changing layout.","error":"Type inference could not determine the pointee type for `with_exposed_provenance_mut` before rebuilding the boxed slice.","rollback_reason":"Compilation failed due to a missing explicit `*mut usize` annotation.","next_action_hint":"Reapply with `let data: *const usize` and `let data: *mut usize` annotations; expected codegen should remain unchanged."}}
{"run":64,"commit":"57a782f","metric":128193.619,"metrics":{"ttt_empty_ns":1413385.792,"ttt_mid_ns":294182.609,"uttt_empty_ns":1428061.7,"uttt_mid_ns":1316040.45,"deep_chain_ns":4204388.458,"wide_512_ns":507931.062,"uttt_rollout_ns":4073.666,"uttt_step_ns":10.729},"status":"discard","description":"Reconstruct compact child pointers with strict-provenance APIs","timestamp":1785188115445,"segment":1,"confidence":8.496664117986665,"asi":{"hypothesis":"Explicit exposed-provenance APIs should clarify pointer round trips with unchanged machine representation.","finding":"Primary was 0.4% worse; search metrics were mixed within a few percent and no speed benefit was expected.","rollback_reason":"Primary did not improve. Rust's existing pointer-to-integer `as` cast already exposes provenance and the inverse cast recovers exposed provenance, so reverting does not leave an invalid round trip on the supported compiler.","next_action_hint":"Keep the simpler documented cast representation; revisit only if raising MSRV and adopting strict-provenance style as a non-performance maintenance change."}}
{"run":65,"commit":"57a782f","metric":130224.365,"metrics":{"ttt_empty_ns":1451054.708,"ttt_mid_ns":326778.984,"uttt_empty_ns":1403713.35,"uttt_mid_ns":1287830.65,"deep_chain_ns":4314234.5,"wide_512_ns":512227.938,"uttt_rollout_ns":4067.948,"uttt_step_ns":10.733},"status":"discard","description":"Encode parent IDs with an eight-byte sentinel wrapper","timestamp":1785188189043,"segment":1,"confidence":8.208097954237182,"asi":{"hypothesis":"Replacing 16-byte Option<usize> with an 8-byte sentinel Parent should shrink every Node another cache word while preserving common is_none/unwrap/equality APIs.","finding":"Despite smaller nodes, TTT midgame regressed 10%, deep-chain 5%, TTT empty 2%, and primary 2%. UTTT/wide were roughly flat. Wrapper/control-flow codegen outweighed the stride reduction on measured trees.","rollback_reason":"Primary and cache-stress workloads regressed, and the additional public field type change is unjustified.","next_action_hint":"Keep Option<usize>; its niche absence costs space but current compiler codegen/backprop path performs better."}}
{"run":66,"commit":"bf32aa1","metric":124938.001,"metrics":{"ttt_empty_ns":1432751.958,"ttt_mid_ns":291662.016,"uttt_empty_ns":1338144.35,"uttt_mid_ns":1217321.1,"deep_chain_ns":4054898.708,"wide_512_ns":509203.906,"uttt_rollout_ns":3995.878,"uttt_step_ns":10.571},"status":"keep","description":"Lookup popcounts for 9-bit game masks","timestamp":1785188243794,"segment":1,"confidence":8.199321588082505,"asi":{"hypothesis":"Portable x86-64 code expands count_ones into software bit hacks; all game masks have only 512 values, so a 512-byte table can make count and rank selection jointly lookup-driven.","result":"Primary improved 2.2%; UTTT empty/mid improved 5.3%/5.6%, TTT mid 1.7%, deep/wide about 1%, while TTT empty was 0.5% slower.","mechanism":"A compile-time byte table supplies forced-board and per-board empty counts used by uniform random selection; it shares cache locality with the existing rank table.","portability":"This avoids target-feature-specific POPCNT/BMI2 intrinsics and remains portable stable Rust. All tests pass."}}
{"run":67,"commit":"bf32aa1","metric":131978.994,"metrics":{"ttt_empty_ns":1412622.5,"ttt_mid_ns":430246.438,"uttt_empty_ns":1326390.95,"uttt_mid_ns":1220416.6,"deep_chain_ns":4103169.708,"wide_512_ns":525700.656,"uttt_rollout_ns":4033.418,"uttt_step_ns":10.754},"status":"discard","description":"Draw compact sampler words through rand::random","timestamp":1785188317183,"segment":1,"confidence":8.263673069942364,"asi":{"hypothesis":"rand::random::<u32>() might provide a smaller direct path than explicitly constructing a ThreadRng handle in the compact sampler.","finding":"TTT midgame regressed 47%, wide 3%, and primary 5.6%; UTTT was roughly flat. Different generic codegen/random stream behavior badly perturbed TTT tree trajectories.","rollback_reason":"Primary and TTT performance regressed catastrophically.","next_action_hint":"Keep explicit ThreadRng::next_u32 in the concrete sampler."}}
{"run":68,"commit":"bf32aa1","metric":121871.441,"metrics":{"ttt_empty_ns":1428313.708,"ttt_mid_ns":294996.531,"uttt_empty_ns":1599967.15,"uttt_mid_ns":1462660.05,"deep_chain_ns":4153326.5,"wide_512_ns":512022.938,"uttt_rollout_ns":3152.819,"uttt_step_ns":7.361},"status":"discard","description":"Pack UTTT boards and metadata into two u128 words","timestamp":1785188437831,"segment":1,"confidence":8.37279046320777,"asi":{"hypothesis":"Packing 81-bit player boards and all metadata into two u128 words shrinks UTTT state from 44 to 32 bytes and nodes from 104 to 96, improving copies and arena stride.","finding":"Direct UTTT step improved 30% and legacy rollout 21%, but both actual UTTT searches regressed 19-20%. Variable u128 mini-board extraction is expensive in tree expansion/random selection and overwhelms the cache-stride benefit. Primary's 2.5% gain is microbenchmark-weight driven.","rollback_reason":"Two key end-to-end user workloads regressed catastrophically; keeping would overfit state microbenchmarks despite lower primary aggregate.","next_action_hint":"Retain [u16;9] boards. A future packed representation would need cached/cheap mini-board extraction or architecture-specific bit operations before it can help search."}}
{"run":69,"commit":"bf32aa1","metric":130365.838,"metrics":{"ttt_empty_ns":1438562.375,"ttt_mid_ns":298104.016,"uttt_empty_ns":1359046.2,"uttt_mid_ns":1253154.95,"deep_chain_ns":4161357.75,"wide_512_ns":520299.75,"uttt_rollout_ns":3963.732,"uttt_step_ns":13.31},"status":"discard","description":"Interleave X and O bits per UTTT mini-board","timestamp":1785188510075,"segment":1,"confidence":8.60439747778931,"asi":{"hypothesis":"Packing each mini-board's X/O masks into one u32 keeps the 44-byte state size while halving streams/loads for occupancy scans.","finding":"UTTT searches regressed 1.5-3%, direct step 26%, and primary 4.3%. Extra shifts/masks to separate players outweigh fewer loads; the compiler already handles parallel [u16;9] arrays efficiently.","rollback_reason":"Primary and targeted UTTT workloads regressed.","next_action_hint":"Keep separate [u16;9] player arrays; both u128 global packing and u32 mini-board interleaving lose on real search."}}
{"run":70,"commit":"bf32aa1","metric":126210.437,"metrics":{"ttt_empty_ns":1430828.708,"ttt_mid_ns":299691.031,"uttt_empty_ns":1342473.85,"uttt_mid_ns":1240378.5,"deep_chain_ns":4080382.458,"wide_512_ns":511209.5,"uttt_rollout_ns":4051.482,"uttt_step_ns":10.669},"status":"discard","description":"Pre-multiply cached parent factors by exploration constant","timestamp":1785188557322,"segment":1,"confidence":8.734970597445198,"asi":{"hypothesis":"Because c is fixed per Mcts, storing c*sqrt(log(n)) should remove one multiplication from every cached parent selection.","finding":"TTT midgame regressed 2.8%, wide 0.4%, other searches were flat, and primary worsened 1.0%. Moving the multiplication into table construction changes rounding/tree trajectories without useful arithmetic savings.","rollback_reason":"Primary and intended cached-factor workloads did not improve.","next_action_hint":"Keep sqrt-log independent of c and multiply once per scan; it is negligible beside child comparisons."}}
{"run":71,"commit":"bf32aa1","metric":125455.231,"metrics":{"ttt_empty_ns":1543771.75,"ttt_mid_ns":294058.562,"uttt_empty_ns":1395162,"uttt_mid_ns":1298058.15,"deep_chain_ns":4095980.292,"wide_512_ns":425699.125,"uttt_rollout_ns":4031.801,"uttt_step_ns":10.617},"status":"discard","description":"Split search statistics into compact parallel arrays","timestamp":1785188646441,"segment":1,"confidence":8.869567718273663,"asi":{"hypothesis":"Parallel parent/reward/visit/q arrays should make UCB two dense streams and keep backprop working sets in L1 while public Node stats synchronize after search.","finding":"Wide-512 improved 16.4%, validating SoA scanning, but TTT empty regressed 7.8%, UTTT 4-7%, and primary 0.4%. Four side allocations/growth plus end sync and duplicate cold fields outweigh dense scans in realistic trees.","rollback_reason":"Primary and three major end-to-end workloads regressed; public stats are also stale during search/panic.","next_action_hint":"A true breaking Arena SoA that removes statistics from Node remains promising for very wide trees; duplicating stats for API compatibility cannot deliver a broad win."}}
{"run":72,"commit":"bf32aa1","metric":144098.49,"metrics":{"ttt_empty_ns":1541888,"ttt_mid_ns":375744.922,"uttt_empty_ns":1471847.05,"uttt_mid_ns":1315249.05,"deep_chain_ns":4573376.417,"wide_512_ns":657521.688,"uttt_rollout_ns":4548.142,"uttt_step_ns":12.119},"status":"discard","description":"Remove bounds checks from cached UCB child loads","timestamp":1785188691849,"segment":1,"confidence":9.069394742898345,"asi":{"hypothesis":"Expansion-created IDs and root-budgeted caches prove UCB child/table indices valid, so unchecked loads could remove hot bounds branches.","finding":"Every workload regressed: wide 29%, TTT mid 29%, primary 15%. Unchecked access changed optimizer/code layout unfavorably and removed useful assumptions/check structure rather than helping.","rollback_reason":"Primary and all target workloads regressed catastrophically; unsafe code provides no win.","next_action_hint":"Keep safe indexing. The compiler's bounds checks are cheap/predictable and safer."}}
{"run":73,"commit":"bf32aa1","metric":125399.455,"metrics":{"ttt_empty_ns":1392082.708,"ttt_mid_ns":292672.484,"uttt_empty_ns":1325882,"uttt_mid_ns":1222515.1,"deep_chain_ns":4110445.25,"wide_512_ns":524374.75,"uttt_rollout_ns":4038.506,"uttt_step_ns":10.637},"status":"discard","description":"Expose direct length methods on compact child lists","timestamp":1785188734779,"segment":1,"confidence":9.13954814182288,"asi":{"hypothesis":"Inherent len/is_empty methods can avoid constructing/tag-checking a slice on every selection leaf test while preserving collection ergonomics.","finding":"TTT empty improved 2.8% and UTTT about 1%, but wide regressed 3%, other metrics were flat, and primary worsened 0.37%. Compiler already reduces deref-to-slice is_empty to the stored length.","rollback_reason":"Primary did not improve; extra API surface has no robust benefit.","next_action_hint":"Keep the minimal Children API and rely on inlining through Deref."}}
{"run":74,"commit":"bf32aa1","metric":129058.093,"metrics":{"ttt_empty_ns":1511876.542,"ttt_mid_ns":293896.703,"uttt_empty_ns":1397953.55,"uttt_mid_ns":1279808.8,"deep_chain_ns":4218782.458,"wide_512_ns":522725.688,"uttt_rollout_ns":4081.062,"uttt_step_ns":10.757},"status":"discard","description":"Store inverse-square-root UCB factors as f32","timestamp":1785188773408,"segment":1,"confidence":9.49323840699759,"asi":{"hypothesis":"Halving inverse-root table footprint should improve cache residency; conversion to f64 is cheap relative to child scanning.","finding":"Every end-to-end search regressed 1-6%, deep/wide 3%, and primary 3.3%. Reduced precision changes UCB ordering/tree trajectories and conversion overhead erases memory savings.","rollback_reason":"Primary and all search metrics regressed; the precision change is also behaviorally riskier.","next_action_hint":"Keep f64 lookup factors to preserve UCB ordering and avoid conversions."}}
{"run":75,"commit":"bf32aa1","metric":127856.228,"metrics":{"ttt_empty_ns":1402518.083,"ttt_mid_ns":295417.625,"uttt_empty_ns":1420878.85,"uttt_mid_ns":1319151.55,"deep_chain_ns":4072168.417,"wide_512_ns":517422.937,"uttt_rollout_ns":4076.519,"uttt_step_ns":10.706},"status":"discard","description":"Generate TTT legal actions by mask rank lookup","timestamp":1785188814671,"segment":1,"confidence":9.770528264445831,"asi":{"hypothesis":"The shared count/rank tables can emit exactly the legal TTT actions without nine occupancy branches and reserve only the exact result length.","finding":"TTT empty improved 2.1% but midgame regressed 1.3%; unrelated UTTT moved 6-8% slower and primary 2.3%. Indexed rank generation is not consistently better than the compiler's fixed nine-cell loop.","rollback_reason":"Primary regressed and the directly affected TTT workloads disagreed.","next_action_hint":"Keep fixed-loop TTT legal generation; lookup tables remain best only for random rank selection."}}
{"run":76,"commit":"bf32aa1","metric":127515.825,"metrics":{"ttt_empty_ns":1430324.583,"ttt_mid_ns":293475.312,"uttt_empty_ns":1422567.4,"uttt_mid_ns":1308848.6,"deep_chain_ns":4113595.25,"wide_512_ns":507537.375,"uttt_rollout_ns":4057.461,"uttt_step_ns":10.558},"status":"discard","description":"Fast-path power-of-two random bounds","timestamp":1785188883575,"segment":1,"confidence":10.383097073182189,"asi":{"hypothesis":"Late rollouts frequently have 1/2/4/8 actions; returning zero for one and masking a random word for powers of two avoids multiply-high reduction while remaining uniform.","finding":"All four end-to-end searches regressed 0.5-7%, primary 2.1%, and rollout was flat. Consuming a different number/pattern of RNG words changes stochastic tree trajectories enough to erase arithmetic savings.","rollback_reason":"Primary and target searches regressed.","next_action_hint":"Keep one consistent Lemire draw path for every bound; random-stream stability matters to measured MCTS tree growth."}}
{"run":77,"commit":"bf32aa1","metric":0,"metrics":{"ttt_empty_ns":0,"ttt_mid_ns":0,"uttt_empty_ns":0,"uttt_mid_ns":0,"deep_chain_ns":0,"wide_512_ns":0,"uttt_rollout_ns":0,"uttt_step_ns":0},"status":"crash","description":"Move compact sampler rejection handling to a cold path","timestamp":1785189164884,"segment":1,"confidence":10.383097073182189,"asi":{"hypothesis":"The rejection branch is taken less than 1 in 50 million draws for bounds <=81, so outlining threshold/modulo logic should shrink the hot sampler.","error":"Rust parsed `product as u32 < threshold` as generic arguments; the cast needs parentheses in a while condition.","rollback_reason":"Compilation failed due to a trivial parser ambiguity before measurement.","next_action_hint":"Reapply the cold-path sampler with `(product as u32) < threshold`; preserve the first product so rejection-correct uniformity is unchanged."}}
{"run":78,"commit":"bf32aa1","metric":125473.767,"metrics":{"ttt_empty_ns":1415870.5,"ttt_mid_ns":293385.469,"uttt_empty_ns":1315003.05,"uttt_mid_ns":1221664.7,"deep_chain_ns":4124356.458,"wide_512_ns":504143.938,"uttt_rollout_ns":4072.368,"uttt_step_ns":10.872},"status":"discard","description":"Outline the practically unreachable sampler rejection path","timestamp":1785189198492,"segment":1,"confidence":11.077614387423814,"asi":{"hypothesis":"Keeping only one multiply/compare in the hot sampler and moving threshold modulo/retry to a cold function should improve instruction-cache locality without changing accepted random products.","finding":"End-to-end searches moved roughly 0-2% better, but rollout/step and deep noise left primary 0.43% worse. The compiler already lays out the rare branch effectively.","rollback_reason":"Primary did not improve; an extra cold function is not justified.","next_action_hint":"Keep the single compact loop; manual hot/cold splitting has no reliable aggregate value."}}
{"run":79,"commit":"bf32aa1","metric":132839.395,"metrics":{"ttt_empty_ns":1447391.542,"ttt_mid_ns":298921.203,"uttt_empty_ns":1457501.15,"uttt_mid_ns":1320752.05,"deep_chain_ns":4373691.958,"wide_512_ns":550227.094,"uttt_rollout_ns":4273.299,"uttt_step_ns":11.321},"status":"discard","description":"Borrow expansion parents immutably","timestamp":1785189248275,"segment":1,"confidence":11.149789580808395,"asi":{"hypothesis":"Expansion only reads parent state before arena growth, so an immutable lookup may improve alias analysis and express intent.","finding":"All metrics moved 2-9% slower and primary regressed 6.3%; the mutable uniqueness signal may actually help codegen, though broad simultaneous movement also indicates a slow run.","rollback_reason":"Primary and every workload regressed.","next_action_hint":"Keep the existing short-lived get_node_mut borrow in expansion."}}
{"run":80,"commit":"bf32aa1","metric":141217.431,"metrics":{"ttt_empty_ns":1539348.042,"ttt_mid_ns":335668,"uttt_empty_ns":1452810.15,"uttt_mid_ns":1412797.95,"deep_chain_ns":4563101.167,"wide_512_ns":654945.5,"uttt_rollout_ns":4427.93,"uttt_step_ns":11.27},"status":"discard","description":"Mark tree selection as read-only","timestamp":1785189287284,"segment":1,"confidence":11.222911444007465,"asi":{"hypothesis":"Selection does not mutate Mcts, so `&self` may permit stronger no-alias optimization than `&mut self`.","finding":"All workloads regressed 5-29% and primary 13%; immutable aliasing permits more potential aliases than Rust's exclusive borrow, hurting optimization in the hot traversal.","rollback_reason":"Primary and every workload regressed catastrophically.","next_action_hint":"Keep `&mut self` on select as a useful uniqueness/codegen signal even though the method is logically read-only."}}
