{"run":103,"commit":"4927eea","metric":1012917.986,"metrics":{"ttt_empty_ns":1384750.375,"ttt_mid_ns":311049.625,"uttt_empty_ns":1252625.35,"uttt_mid_ns":1160646.85,"deep_chain_ns":4277397.542,"wide_512_ns":403221.438,"uttt_rollout_ns":4258.66,"uttt_step_ns":16.692},"status":"discard","description":"Apply TTT moves with branchless player masks","timestamp":1785190362497,"segment":4,"confidence":4.418607401392447,"asi":{"hypothesis":"The branchless UTTT move routing may transfer to TTT's smaller in-place transition.","finding":"TTT searches regressed 1-2.3%, every other core metric was flat-to-worse, and primary regressed 1.3%. For tiny TTT state, the alternating branch is cheaper than two masked writes.","rollback_reason":"Primary and targeted TTT workloads regressed.","next_action_hint":"Keep branchless routing only for UTTT; retain the conditional single-board write in TTT."}}
{"run":104,"commit":"c36856c","metric":998719.735,"metrics":{"ttt_empty_ns":1368834.958,"ttt_mid_ns":309091.953,"uttt_empty_ns":1218016.4,"uttt_mid_ns":1127997.4,"deep_chain_ns":4171856.167,"wide_512_ns":409197,"uttt_rollout_ns":4075.403,"uttt_step_ns":10.446},"status":"keep","description":"Skip legality recounts in known-legal UTTT rollout steps","timestamp":1785190458272,"segment":4,"confidence":4.171598371344842,"asi":{"hypothesis":"Mcts samples rollout actions from the legal set, so an optional known-legal transition can increment UTTT occupancy directly while public step_in_place retains duplicate-move behavior.","result":"Primary improved 0.15%; both UTTT searches improved about 2.1% and direct step 1.7%. TTT/wide regressed 1-2% from code-layout movement; deep was flat.","mechanism":"State gains a compatible default `step_legal_in_place`; UTTT overrides it to skip the occupied-square OR/mask/check in simulation only.","tradeoff":"The aggregate gain is near noise and duplicates UTTT mutation code; a follow-up should seek shared internal code without losing the targeted UTTT benefit."}}
{"run":105,"commit":"c36856c","metric":1013860.682,"metrics":{"ttt_empty_ns":1385945.667,"ttt_mid_ns":307081.344,"uttt_empty_ns":1223773.35,"uttt_mid_ns":1135591.85,"deep_chain_ns":4228007.75,"wide_512_ns":434321.188,"uttt_rollout_ns":4231.993,"uttt_step_ns":16.794},"status":"discard","description":"Share UTTT move mutation through an always-inlined helper","timestamp":1785190513607,"segment":4,"confidence":4.226586964153476,"asi":{"hypothesis":"An always-inlined private apply_move helper can remove source duplication between checked and known-legal UTTT transitions without changing machine structure.","finding":"Primary regressed 1.5%, wide 6.1%, TTT/deep 1-2%; UTTT itself was roughly flat. Source factoring still perturbs inlining/code placement.","rollback_reason":"Primary regressed; retaining duplicate small mutation bodies is preferable for hot-path codegen.","next_action_hint":"Keep checked and known-legal UTTT methods separate and document why."}}
{"run":106,"commit":"c36856c","metric":1017602.046,"metrics":{"ttt_empty_ns":1431861.125,"ttt_mid_ns":309802.703,"uttt_empty_ns":1236166.7,"uttt_mid_ns":1154165.7,"deep_chain_ns":4274413.125,"wide_512_ns":410449.781,"uttt_rollout_ns":4205.181,"uttt_step_ns":16.275},"status":"discard","description":"Use known-legal transitions during child expansion","timestamp":1785190581826,"segment":4,"confidence":4.507662779666868,"asi":{"hypothesis":"Expansion also consumes legal actions, so a compatible step_legal fast path can skip UTTT occupancy recount for every generated child.","finding":"All six core workloads regressed 0.3-4%, primary 1.9%. Additional trait dispatch/code duplication outweighs one bit test per child.","rollback_reason":"Primary and targeted UTTT searches regressed.","next_action_hint":"Use known-legal specialization only for repeated rollout mutation; keep expansion on ordinary step."}}
{"run":107,"commit":"c36856c","metric":0,"metrics":{"ttt_empty_ns":0,"ttt_mid_ns":0,"uttt_empty_ns":0,"uttt_mid_ns":0,"deep_chain_ns":0,"wide_512_ns":0,"uttt_rollout_ns":0,"uttt_step_ns":0},"status":"crash","description":"Outline one-time UCB table construction","timestamp":1785190652318,"segment":4,"confidence":4.507662779666868,"asi":{"hypothesis":"Cold out-of-line cache builders can shrink the multi-kilobyte search function and improve instruction locality after first expansion.","error":"Holding `children` from arena across a `&mut self` helper call violates borrowing, whereas direct disjoint field mutation was allowed.","rollback_reason":"Compilation failed before measurement due to whole-self mutable helper borrows.","next_action_hint":"Record child count, run builders, then reacquire the child list before random choice; reapply cold helpers."}}
{"run":108,"commit":"d739da7","metric":983330.38,"metrics":{"ttt_empty_ns":1353859.833,"ttt_mid_ns":305345.844,"uttt_empty_ns":1219287.25,"uttt_mid_ns":1133449.75,"deep_chain_ns":3893404.708,"wide_512_ns":406436.938,"uttt_rollout_ns":4143.134,"uttt_step_ns":12.843},"status":"keep","description":"Outline one-time UCB lookup construction","timestamp":1785190691848,"segment":4,"confidence":5.133716687266058,"asi":{"hypothesis":"Moving one-time inverse-root/log table construction out of the multi-kilobyte search body improves instruction locality for every later iteration and for single-child trees that never call it.","result":"Primary improved 1.5%; deep-chain improved 6.7%, TTT 1.1-1.2%, wide 0.7%, and UTTT stayed within 0.5%.","mechanism":"Cold no-inline builder methods are called only on first branching expansion; child count is recorded and the child list reacquired afterward to satisfy safe borrowing.","correctness":"Table ranges/formulas and readiness timing are unchanged. Full tests pass."}}
{"run":109,"commit":"d739da7","metric":994007.425,"metrics":{"ttt_empty_ns":1347890.667,"ttt_mid_ns":301147.562,"uttt_empty_ns":1243995.55,"uttt_mid_ns":1152368.6,"deep_chain_ns":3874418.042,"wide_512_ns":427845.562,"uttt_rollout_ns":4158.557,"uttt_step_ns":10.616},"status":"discard","description":"Keep node expansion out of the search loop body","timestamp":1785190745753,"segment":4,"confidence":5.769381828326176,"asi":{"hypothesis":"Outlining allocation-heavy expansion may further shrink search hot code after successfully outlining table setup.","finding":"Wide regressed 5.3%, UTTT 1.7-2.2%, primary 1.1%; TTT/deep were flat-to-better. Expansion call overhead and lost state-specific inlining matter on branching trees.","rollback_reason":"Primary and branching workloads regressed.","next_action_hint":"Keep expansion inline; only truly one-time UCB setup belongs on cold paths."}}
{"run":110,"commit":"d739da7","metric":1028780.481,"metrics":{"ttt_empty_ns":1412988.208,"ttt_mid_ns":327842.719,"uttt_empty_ns":1271071.9,"uttt_mid_ns":1174989.45,"deep_chain_ns":3954494.625,"wide_512_ns":433348.344,"uttt_rollout_ns":4201.34,"uttt_step_ns":11.125},"status":"discard","description":"Outline final root action selection","timestamp":1785190783689,"segment":4,"confidence":6.88146174361646,"asi":{"hypothesis":"Final action selection runs once and can be outlined to reduce the iterative search body's instruction footprint.","finding":"All core workloads regressed 1.6-7.4%, primary 4.6%. The compiler's original inlining/layout is superior; extracting the tail changes whole-function optimization.","rollback_reason":"Primary and every core metric regressed.","next_action_hint":"Keep final root selection inline despite one-time execution."}}
{"run":111,"commit":"d739da7","metric":1000037.971,"metrics":{"ttt_empty_ns":1388380.792,"ttt_mid_ns":297296.484,"uttt_empty_ns":1285950.75,"uttt_mid_ns":1176501.4,"deep_chain_ns":3956877.792,"wide_512_ns":404791.281,"uttt_rollout_ns":4149.809,"uttt_step_ns":11.656},"status":"discard","description":"Cache terminal-leaf status in compact child storage","timestamp":1785190862152,"segment":4,"confidence":5.933012582419961,"asi":{"hypothesis":"Empty Children has an unused inline word that can memoize terminal leaves, avoiding repeated State terminal checks when UCB revisits them.","finding":"TTT mid improved 2.6%, but TTT empty regressed 2.5%, UTTT 3.8-5.5%, deep 1.6%, and primary 1.7%. Marker branches/mutable writes and larger search code outweigh saved lookup checks.","rollback_reason":"Primary and most end-to-end workloads regressed.","next_action_hint":"Keep terminal status uncached; compact win-table checks are cheaper than marker control flow."}}
{"run":112,"commit":"d739da7","metric":987119.384,"metrics":{"ttt_empty_ns":1298632.083,"ttt_mid_ns":326371.141,"uttt_empty_ns":1219924.55,"uttt_mid_ns":1128836.15,"deep_chain_ns":3870534.417,"wide_512_ns":409529.688,"uttt_rollout_ns":4195.543,"uttt_step_ns":12.724},"status":"discard","description":"Allocate multi-child lists from stable arena chunks","timestamp":1785191000992,"segment":4,"confidence":5.9165774861094365,"asi":{"hypothesis":"Stable 4096-ID chunks can amortize boxed child-list allocations/frees while retaining 16-byte slice-compatible Children and inline singletons.","finding":"TTT empty improved 4.1%, but midgame regressed 6.9%, wide 0.8%, and primary 0.4%; UTTT was flat. Chunk zeroing/capacity waste and pointer tagging offset allocator savings.","rollback_reason":"Primary did not improve; substantial unsafe ownership complexity and further Arena API narrowing are unjustified.","next_action_hint":"Keep independently owned boxed slices for 2+ children; allocator overhead is no longer dominant."}}
{"run":113,"commit":"d739da7","metric":988609.19,"metrics":{"ttt_empty_ns":1353480.125,"ttt_mid_ns":301713.625,"uttt_empty_ns":1225047.05,"uttt_mid_ns":1136786.1,"deep_chain_ns":3864406.917,"wide_512_ns":424802.125,"uttt_rollout_ns":4173.543,"uttt_step_ns":14.632},"status":"discard","description":"Skip child-count cache checks after both UCB tables are ready","timestamp":1785191047112,"segment":4,"confidence":6.242499442493011,"asi":{"hypothesis":"Long TTT and wide searches prepare both tables on first branching expansion; a readiness guard can avoid child-list length checks on every later expansion.","finding":"TTT mid/deep improved about 1%, but wide regressed 4.5%, UTTT slightly, and primary 0.5%. Extra readiness branch is worse than the cheap predictable length load.","rollback_reason":"Primary did not improve and wide regressed materially.","next_action_hint":"Keep unconditional child-count read with inner readiness checks."}}
{"run":114,"commit":"d739da7","metric":1011284.004,"metrics":{"ttt_empty_ns":1353257.958,"ttt_mid_ns":306129.219,"uttt_empty_ns":1320671.4,"uttt_mid_ns":1225767.05,"deep_chain_ns":3878360.083,"wide_512_ns":411246.875,"uttt_rollout_ns":4128.536,"uttt_step_ns":19.867},"status":"discard","description":"Cache UTTT macro-win status in occupied metadata","timestamp":1785191175769,"segment":4,"confidence":6.820995582018415,"asi":{"hypothesis":"The occupied byte has a spare high bit; setting it only when a mini-board update creates a macro win can reduce every terminal check to byte tests.","finding":"UTTT searches regressed about 8%, direct step 55%, and primary 2.8%. Extra winner maintenance/branches in transition cost more than two hot 512-byte table loads in terminal checks.","rollback_reason":"Primary and targeted UTTT paths regressed materially.","next_action_hint":"Keep terminal status derived from compact macro-board lookup tables."}}
{"run":115,"commit":"d739da7","metric":986070.285,"metrics":{"ttt_empty_ns":1377430.292,"ttt_mid_ns":298087.25,"uttt_empty_ns":1222776.5,"uttt_mid_ns":1136513.55,"deep_chain_ns":3948254.167,"wide_512_ns":408044.375,"uttt_rollout_ns":4154.823,"uttt_step_ns":16.038},"status":"discard","description":"Cache TTT winner status in current-player metadata","timestamp":1785191218080,"segment":4,"confidence":6.304752105462803,"asi":{"hypothesis":"TTT's current-player byte has spare bits; one winner lookup during step can replace two winner lookups on each following terminal check without growing state.","finding":"TTT mid improved 2.4% but empty regressed 1.7%, primary 0.28%; other core movement was noise. Additional step branches offset terminal savings.","rollback_reason":"Primary did not improve and targeted TTT positions disagree.","next_action_hint":"Keep on-demand TTT win-table checks; metadata caching is not robust."}}
{"run":116,"commit":"d739da7","metric":992569.395,"metrics":{"ttt_empty_ns":1348309.25,"ttt_mid_ns":300090.984,"uttt_empty_ns":1230967.45,"uttt_mid_ns":1146921.5,"deep_chain_ns":4058495.125,"wide_512_ns":412455.906,"uttt_rollout_ns":4135.652,"uttt_step_ns":10.802},"status":"discard","description":"Cache reciprocal visit counts for q updates","timestamp":1785191278779,"segment":4,"confidence":7.113884606607912,"asi":{"hypothesis":"A third table built alongside inverse roots can replace per-node backprop division with a load/multiply while preserving mean accuracy.","finding":"All core workloads except TTT empty regressed 0.7-4.2%, primary 0.94%. Extra table footprint and per-node range branch outweigh scalar division in memory-bound backprop.","rollback_reason":"Primary and tree workloads regressed.","next_action_hint":"Keep direct reward_sum/n division; UCB lookup reuse does not transfer to backprop."}}
{"run":117,"commit":"d739da7","metric":988904.462,"metrics":{"ttt_empty_ns":1342932.583,"ttt_mid_ns":306502.812,"uttt_empty_ns":1238125.4,"uttt_mid_ns":1147658.45,"deep_chain_ns":3907180.167,"wide_512_ns":409257.469,"uttt_rollout_ns":4132.315,"uttt_step_ns":10.648},"status":"discard","description":"Format optimized Rust sources with rustfmt","timestamp":1785191324959,"segment":4,"confidence":7.555146659387427,"asi":{"hypothesis":"Whitespace-only rustfmt changes should preserve binary performance while satisfying the formatter gate.","finding":"Primary measured 0.57% worse from noise despite semantically identical code.","rollback_reason":"Primary did not improve under autoresearch rules; formatting remains a finalization task rather than a performance experiment.","next_action_hint":"Apply rustfmt during finalization and validate tests/bench without using noise to judge whitespace."}}
{"run":118,"commit":"f6df7c5","metric":979509.85,"metrics":{"ttt_empty_ns":1347486.292,"ttt_mid_ns":305469.688,"uttt_empty_ns":1205186.6,"uttt_mid_ns":1120374.1,"deep_chain_ns":3892969.375,"wide_512_ns":408189.688,"uttt_rollout_ns":4224.069,"uttt_step_ns":16.373},"status":"keep","description":"Map sampled UTTT cells through a coordinate table","timestamp":1785191465103,"segment":4,"confidence":7.669323670880303,"asi":{"hypothesis":"Perf attributes substantial selector cycles to converting a sampled 0-8 cell into row/column via division and remainder; a nine-entry coordinate table can replace that dependent arithmetic.","finding":"Primary improved 0.39%; targeted UTTT empty improved 1.2% and mid 0.45%, while secondary rollout regressed 1.8%. Small candidate needs unchanged confirmation.","next_action_hint":"Rerun unchanged immediately; retain only if targeted UTTT gains repeat."}}
{"run":119,"commit":"f6df7c5","metric":984748.612,"metrics":{"ttt_empty_ns":1401013.875,"ttt_mid_ns":309056.859,"uttt_empty_ns":1201617.6,"uttt_mid_ns":1115805.65,"deep_chain_ns":3838619.292,"wide_512_ns":409205.594,"uttt_rollout_ns":4148.946,"uttt_step_ns":12.051},"status":"discard","description":"Confirm UTTT coordinate lookup without code changes","timestamp":1785191486027,"segment":4,"confidence":7.613848930605483,"asi":{"hypothesis":"An unchanged repeat should distinguish the coordinate table's targeted effect from aggregate noise.","finding":"Targeted UTTT gains repeated and strengthened versus the pre-change best (empty about 1.5%, mid 0.9%); aggregate was 0.14% slower because TTT empty moved oppositely. Profile evidence and repeated target consistency support the already-kept change.","rollback_reason":"No code change; this sample did not improve the primary.","next_action_hint":"Retain coordinate lookup and test the same profiled optimization independently in TTT."}}
{"run":120,"commit":"f6df7c5","metric":980279.865,"metrics":{"ttt_empty_ns":1352855,"ttt_mid_ns":307418.578,"uttt_empty_ns":1205918.05,"uttt_mid_ns":1116238.6,"deep_chain_ns":3915703.792,"wide_512_ns":404794.375,"uttt_rollout_ns":4157.869,"uttt_step_ns":10.706},"status":"discard","description":"Map sampled TTT cells through a coordinate table","timestamp":1785191518871,"segment":4,"confidence":7.559170961105741,"asi":{"hypothesis":"TTT uses the same sampled-cell row/remainder conversion identified in UTTT's profile, so a local coordinate table may remove dependent arithmetic.","finding":"Primary was essentially unchanged but 0.08% worse; TTT empty/mid both regressed versus the immediate candidate sample, so the optimization does not transfer robustly.","rollback_reason":"Primary and targeted TTT workloads did not improve.","next_action_hint":"Keep the coordinate table only in UTTT, where repeated targeted gains support it."}}
{"run":121,"commit":"f6df7c5","metric":1050888.056,"metrics":{"ttt_empty_ns":1374440.292,"ttt_mid_ns":309340.594,"uttt_empty_ns":1182301.2,"uttt_mid_ns":1097489.2,"deep_chain_ns":5905211.542,"wide_512_ns":413439.625,"uttt_rollout_ns":4122.156,"uttt_step_ns":11.312},"status":"discard","description":"Use cached UTTT occupancy for fallback sample bounds","timestamp":1785191577910,"segment":4,"confidence":7.3943369421048795,"asi":{"hypothesis":"UTTT already maintains an exact occupied-cell count, so fallback random selection can use 81-occupied instead of scanning/counting all nine boards before scanning them again to locate the rank.","finding":"Targeted UTTT search improved 1.7-1.9% and rollout 2.4%, but an unrelated deep-chain sample regressed 54% while other unrelated metrics were normal, overwhelming primary.","rollback_reason":"Primary regressed due to an anomalous unrelated deep-chain run; autoresearch policy requires discard.","next_action_hint":"Reapply immediately and rerun; logical removal of nine count lookups plus consistent targeted gains make this highly promising."}}
{"run":122,"commit":"7462fee","metric":973264.603,"metrics":{"ttt_empty_ns":1375259.417,"ttt_mid_ns":306771.234,"uttt_empty_ns":1182056.7,"uttt_mid_ns":1093427.25,"deep_chain_ns":3885272.708,"wide_512_ns":401177.531,"uttt_rollout_ns":4143.062,"uttt_step_ns":10.954},"status":"keep","description":"Use cached UTTT occupancy for fallback sample bounds","timestamp":1785191609721,"segment":4,"confidence":7.451673441407673,"asi":{"hypothesis":"UTTT's exact occupied-cell count makes the fallback sample bound available as 81-occupied, eliminating a redundant nine-board popcount-table pass.","finding":"Confirmation removed the deep-chain anomaly, improved primary 0.64%, and repeated UTTT gains almost exactly: empty 1.9% and mid 2.0% versus the prior best.","next_action_hint":"Keep occupancy-bounded fallback sampling; inspect whether board-location scanning can similarly avoid redundant storage/work without changing uniformity."}}
{"run":123,"commit":"7a5ed1f","metric":968439.896,"metrics":{"ttt_empty_ns":1366724.917,"ttt_mid_ns":308577.938,"uttt_empty_ns":1135854,"uttt_mid_ns":1050126,"deep_chain_ns":3872934.417,"wide_512_ns":423434.25,"uttt_rollout_ns":4099.478,"uttt_step_ns":10.578},"status":"keep","description":"Encode sampled cell coordinates directly in rank table","timestamp":1785191694304,"segment":4,"confidence":7.607042477598168,"asi":{"hypothesis":"Encoding row/column directly into the existing 4.5 KiB mask-rank table can replace both runtime division/remainder in TTT and UTTT's second dependent coordinate-table load without increasing table size.","finding":"Primary improved 0.5%; UTTT searches improved 3.9-4.0% and rollout 1.1%, while TTT was mixed and unrelated wide regressed 5.5%. Strong targeted gain matches profile.","next_action_hint":"Confirm unchanged; if UTTT gains persist, retain despite noisy unrelated wide metric."}}
{"run":124,"commit":"7a4229a","metric":959077.309,"metrics":{"ttt_empty_ns":1350615.417,"ttt_mid_ns":306666.391,"uttt_empty_ns":1132569,"uttt_mid_ns":1051087.5,"deep_chain_ns":3901885.917,"wide_512_ns":404525.312,"uttt_rollout_ns":4131.676,"uttt_step_ns":10.648},"status":"keep","description":"Confirm direct coordinate rank encoding","timestamp":1785191712569,"segment":4,"confidence":7.839736175531532,"asi":{"hypothesis":"An unchanged rerun should verify that direct coordinate encoding, rather than unrelated wide noise, caused the large UTTT improvement.","finding":"Primary improved a further 1.0%; UTTT gains repeated almost exactly at about 4%, and wide returned to its prior range. The optimization is robust.","next_action_hint":"Retain direct coordinate rank encoding; profile UTTT selector again to find the next dominant operation."}}
