{"run":125,"commit":"7a4229a","metric":1045106.285,"metrics":{"ttt_empty_ns":1385646.667,"ttt_mid_ns":308434.109,"uttt_empty_ns":1409095.4,"uttt_mid_ns":1286562.5,"deep_chain_ns":4128780.958,"wide_512_ns":407337.812,"uttt_rollout_ns":3702.14,"uttt_step_ns":9.007},"status":"discard","description":"Pack UTTT metadata into spare board bits","timestamp":1785192138378,"segment":4,"confidence":7.740297391011119,"asi":{"hypothesis":"Packing macro boards, current player, next board, and occupancy into spare high bits of the existing u16 board arrays shrinks UTTT state 44->36 bytes and Node 104->96 while retaining separate board streams.","finding":"State micros improved strongly (rollout 10.4%, step 15.4%) and target sizes were achieved, but end-to-end UTTT searches regressed 22-24% and primary 9.0%. Metadata extraction/update and/or changed 96-byte Node field layout is hostile to expansion/search despite cheaper isolated transitions.","rollback_reason":"Two core UTTT searches regressed catastrophically; preserving realistic end-to-end performance dominates microbench gains.","next_action_hint":"Keep explicit metadata and 104-byte UTTT nodes. Any future 96-byte layout needs a hot/cold Node redesign rather than hiding metadata inside board words."}}
{"run":126,"commit":"7a4229a","metric":954758.812,"metrics":{"ttt_empty_ns":1352866.875,"ttt_mid_ns":306759.359,"uttt_empty_ns":1116317.65,"uttt_mid_ns":1037731.6,"deep_chain_ns":3894660.708,"wide_512_ns":404544.875,"uttt_rollout_ns":4083.625,"uttt_step_ns":14.4},"status":"checks_failed","description":"Check only the moving player's UTTT mini-board for wins","timestamp":1785192314086,"segment":4,"confidence":7.64334956352759,"asi":{"hypothesis":"Only the moving player's mini-board can acquire a new win, so checking one win-table entry instead of X then O should reduce every UTTT transition's work.","finding":"Primary improved 0.45% and UTTT searches 1.3-1.4%, but behavior_ultimate's stochastic never-loses test failed at seed 0. Public step's permissive duplicate-move semantics may make the one-player assumption observably different, or the faster RNG trajectory may expose test variance.","rollback_reason":"Full correctness suite failed; no optimization can be kept without confirmation and semantic investigation.","next_action_hint":"Reapply only to step_legal_in_place (where MCTS guarantees sampled legal actions) while retaining two-player checks in public step_in_place, then rerun."}}
{"run":127,"commit":"67c8041","metric":953570.372,"metrics":{"ttt_empty_ns":1355420.125,"ttt_mid_ns":306929.016,"uttt_empty_ns":1117688.55,"uttt_mid_ns":1032874.55,"deep_chain_ns":3863700.708,"wide_512_ns":405165.781,"uttt_rollout_ns":4129.885,"uttt_step_ns":15.166},"status":"keep","description":"Check only the moving player after known-legal UTTT rollout moves","timestamp":1785192404515,"segment":4,"confidence":7.640902711178411,"asi":{"hypothesis":"The rollout-specific step_legal_in_place guarantee means only the moving player's board can newly win, allowing one mini-board win lookup while public/expansion transitions retain permissive semantics.","finding":"Primary improved 0.57%, UTTT empty 1.3%, mid 1.7%, and full checks passed. The noisy step diagnostic regressed but benchmarks ordinary step, which this change does not touch.","next_action_hint":"Retain the known-legal one-player macro update; consider reducing duplication while ensuring it does not alter hot-path inlining."}}
{"run":128,"commit":"b684991","metric":951360.942,"metrics":{"ttt_empty_ns":1361470.333,"ttt_mid_ns":305771.328,"uttt_empty_ns":1098689.55,"uttt_mid_ns":1019336.5,"deep_chain_ns":3934239.792,"wide_512_ns":404216.062,"uttt_rollout_ns":4106.272,"uttt_step_ns":13.056},"status":"keep","description":"Fuse UTTT terminal detection with rollout reward","timestamp":1785192614724,"segment":4,"confidence":7.400865451138006,"asi":{"hypothesis":"A compatible terminal_reward State hook lets UTTT determine terminality and reward in one pair of macro-board lookups, eliminating repeated winner checks at the end of every simulation.","finding":"Primary improved 0.23%; UTTT empty/mid improved 1.7%/1.3%. TTT and synthetic movement was mixed noise. Default implementations preserve external states' original calls.","next_action_hint":"Confirm the small targeted win; consider a TTT specialization only if its winner checks show similar duplication costs."}}
{"run":129,"commit":"b684991","metric":1025649.125,"metrics":{"ttt_empty_ns":1351384.917,"ttt_mid_ns":457669.328,"uttt_empty_ns":1109489.45,"uttt_mid_ns":1018207.95,"deep_chain_ns":3926144.75,"wide_512_ns":424361.562,"uttt_rollout_ns":4110.987,"uttt_step_ns":14.142},"status":"discard","description":"Confirm fused UTTT terminal reward without code changes","timestamp":1785192651435,"segment":4,"confidence":7.712433188959349,"asi":{"hypothesis":"An unchanged rerun should confirm the terminal-reward hook's targeted UTTT gain.","finding":"UTTT mid repeated a 1.4% gain and empty retained about 0.7% versus pre-change; an unrelated TTT-mid sample regressed 49% and dominated aggregate. Other unrelated metrics were near range.","rollback_reason":"No code change and primary was overwhelmed by an isolated TTT-mid anomaly.","next_action_hint":"Retain already-kept fused UTTT terminal reward based on repeated target metrics; continue with independent hypotheses."}}
{"run":130,"commit":"9d634f7","metric":950041.733,"metrics":{"ttt_empty_ns":1344279.125,"ttt_mid_ns":302728.672,"uttt_empty_ns":1099090.5,"uttt_mid_ns":1014783.5,"deep_chain_ns":3834205.167,"wide_512_ns":422504.062,"uttt_rollout_ns":4129.166,"uttt_step_ns":16.2},"status":"keep","description":"Fuse TTT terminal detection with rollout reward","timestamp":1785192748331,"segment":4,"confidence":7.441849567757528,"asi":{"hypothesis":"TTT can use the same terminal_reward hook to avoid repeating winner-table checks at the end of every simulation.","finding":"Primary improved 0.14%; targeted TTT empty/mid improved 1.3%/1.0%. Deep improved 2.5%, while unrelated wide regressed 4.5%.","next_action_hint":"Retain the small targeted TTT fusion; further terminal-path specialization is unlikely to matter."}}
{"run":131,"commit":"9d634f7","metric":961635.809,"metrics":{"ttt_empty_ns":1372755.958,"ttt_mid_ns":303380.219,"uttt_empty_ns":1133968.75,"uttt_mid_ns":1030712.35,"deep_chain_ns":3887173.042,"wide_512_ns":417936.906,"uttt_rollout_ns":4143.31,"uttt_step_ns":11.631},"status":"discard","description":"Route known-legal UTTT winner updates with player masks","timestamp":1785192829975,"segment":4,"confidence":7.437727638093825,"asi":{"hypothesis":"The existing all-zero/all-one player mask can select the moved mini-board and macro destination without an alternating player branch, leaving only one win-table branch.","finding":"UTTT empty/mid regressed 3.2%/1.6% and primary 1.2%; mask arithmetic and two potential macro stores are worse than the predictable player branch.","rollback_reason":"Primary and targeted UTTT searches regressed.","next_action_hint":"Keep the explicit player branch in the rollout-specific winner update."}}
{"run":132,"commit":"9d634f7","metric":963009.47,"metrics":{"ttt_empty_ns":1392270,"ttt_mid_ns":305357.859,"uttt_empty_ns":1119678.8,"uttt_mid_ns":1037378.8,"deep_chain_ns":3847751.125,"wide_512_ns":419771.531,"uttt_rollout_ns":4140.279,"uttt_step_ns":11.413},"status":"discard","description":"Track remaining UTTT cells instead of occupied cells","timestamp":1785192908960,"segment":4,"confidence":7.538846793529111,"asi":{"hypothesis":"Storing remaining cells initialized to 81 can remove a subtraction from every unrestricted random action while terminal checks become zero comparisons.","finding":"UTTT searches regressed 2.0-2.2%, primary 1.4%; selector subtraction is negligible and decrement/zero-check codegen is worse.","rollback_reason":"Primary and targeted UTTT workloads regressed.","next_action_hint":"Keep occupied-cell count initialized to zero."}}
{"run":133,"commit":"9d634f7","metric":953795.656,"metrics":{"ttt_empty_ns":1361618.458,"ttt_mid_ns":304191.609,"uttt_empty_ns":1089366.5,"uttt_mid_ns":1005094.45,"deep_chain_ns":3861815.542,"wide_512_ns":429889.625,"uttt_rollout_ns":4115.855,"uttt_step_ns":13.989},"status":"discard","description":"Store sampled coordinates prepacked as u16","timestamp":1785192996736,"segment":4,"confidence":6.88082818072964,"asi":{"hypothesis":"Doubling the mask-rank table entries to u16 can return ABI-packed row/column bytes directly, removing shifts/masks from every sampled action.","finding":"UTTT searches improved about 1%, but TTT regressed 0.5-1.3%, wide 1.7%, and primary 0.4%. The 9 KiB table's footprint offsets decode savings.","rollback_reason":"Primary did not improve and compact shared-table users disagree.","next_action_hint":"Keep 4.5 KiB u8 coordinate encoding; do not double lookup footprint for a few ALU instructions."}}
{"run":134,"commit":"9d634f7","metric":958970.167,"metrics":{"ttt_empty_ns":1387390.375,"ttt_mid_ns":304867.062,"uttt_empty_ns":1115523.75,"uttt_mid_ns":1032651.25,"deep_chain_ns":3879614.958,"wide_512_ns":411434.094,"uttt_rollout_ns":4121.463,"uttt_step_ns":10.829},"status":"discard","description":"Check only the previous player for rollout terminal wins","timestamp":1785193120504,"segment":4,"confidence":6.909783372926384,"asi":{"hypothesis":"On valid rollout paths only the player who just moved can have newly won, so terminal_reward can inspect one board and derive reward from player identity.","finding":"Every game search regressed: TTT 0.7-3.2%, UTTT 1.5-1.8%, primary 0.94%. Dynamic board selection and reward-direction control outweigh a second adjacent winner-table load.","rollback_reason":"Primary and all targeted end-to-end workloads regressed; the narrower valid-state assumption is also unnecessary.","next_action_hint":"Keep to-play/opponent winner checks in fused terminal_reward."}}
{"run":135,"commit":"9d634f7","metric":1038006.191,"metrics":{"ttt_empty_ns":1355595.542,"ttt_mid_ns":503156.172,"uttt_empty_ns":1111898.25,"uttt_mid_ns":1026795.3,"deep_chain_ns":3887843.167,"wide_512_ns":413151.25,"uttt_rollout_ns":4169.776,"uttt_step_ns":13.057},"status":"discard","description":"Check fixed player boards in fused terminal reward","timestamp":1785193160024,"segment":4,"confidence":6.88082818072964,"asi":{"hypothesis":"Fixed X-then-O table accesses can remove dynamic to-play board selection on every nonterminal rollout ply, deferring reward-direction branching until a win.","finding":"TTT mid regressed 66%, UTTT 1.2%, rollout 1%, and primary 9.3%. Although valid states have one winner, changed fixed-player precedence/control flow materially changes codegen and stochastic search timing.","rollback_reason":"Primary and critical end-to-end workloads regressed catastrophically.","next_action_hint":"Preserve direct to-play/opponent checks and their established code generation."}}
{"run":136,"commit":"73517d6","metric":932368.903,"metrics":{"ttt_empty_ns":1321317,"ttt_mid_ns":290173.25,"uttt_empty_ns":1108962.8,"uttt_mid_ns":1026368.25,"deep_chain_ns":3778409.625,"wide_512_ns":398412.594,"uttt_rollout_ns":4200.316,"uttt_step_ns":10.63},"status":"keep","description":"Construct expansion children directly in arena spare capacity","timestamp":1785193243829,"segment":4,"confidence":6.904741456985598,"asi":{"hypothesis":"Expansion currently materializes each Node before Vec::push; writing Node::new into initialized spare arena capacity may eliminate a 104-byte intermediate copy visible in UTTT assembly.","finding":"Primary improved 1.86%; TTT improved 1.7-4.1%, deep 1.5%, and wide 5.7%. UTTT regressed about 1%, requiring confirmation. Full checks pass.","safety_invariant":"Capacity is ensured first; spare_capacity_mut()[0] is written exactly once; Vec length is increased by one only after the complete Node is initialized.","next_action_hint":"Test a safe add_child wrapper using Vec::push to determine whether the API shape or explicit spare-capacity write produced the gain; retain unsafe only for a confirmed incremental win."}}
{"run":137,"commit":"73517d6","metric":966075.614,"metrics":{"ttt_empty_ns":1353028.042,"ttt_mid_ns":301872.547,"uttt_empty_ns":1128314.65,"uttt_mid_ns":1043149.7,"deep_chain_ns":3848801.25,"wide_512_ns":439373.594,"uttt_rollout_ns":4180.632,"uttt_step_ns":11.4},"status":"discard","description":"Use safe Vec push inside direct child constructor","timestamp":1785193322867,"segment":4,"confidence":7.152905764188716,"asi":{"hypothesis":"A safe add_child wrapper may preserve the direct-construction codegen win while delegating initialization and length handling to Vec::push.","finding":"Every core metric regressed 1.7-10.3% versus explicit spare-capacity initialization; primary 3.6%. LLVM materializes/copies Node through Vec::push despite the improved API shape.","rollback_reason":"Primary and all core workloads regressed; safe wrapper does not preserve direct destination construction.","next_action_hint":"Retain the small explicit unsafe initialization with documented capacity/write/set_len invariant; rerun unchanged unsafe version to confirm its broad gain."}}
{"run":138,"commit":"73517d6","metric":932513.319,"metrics":{"ttt_empty_ns":1313245.375,"ttt_mid_ns":289284.344,"uttt_empty_ns":1100257.85,"uttt_mid_ns":1011481.35,"deep_chain_ns":3840133.375,"wide_512_ns":405005.375,"uttt_rollout_ns":4155.416,"uttt_step_ns":10.535},"status":"discard","description":"Confirm direct arena child initialization without code changes","timestamp":1785193364774,"segment":4,"confidence":6.946360291495453,"asi":{"hypothesis":"An unchanged rerun of explicit spare-capacity initialization should confirm that the broad gain was codegen rather than noise.","finding":"Primary repeated within 0.02%. TTT retained 2.3-4.4% gains and wide 4.1% versus pre-change; UTTT/deep were near pre-change. The safe Vec::push variant's broad regression confirms direct destination initialization matters.","rollback_reason":"No code change; sample was fractionally above the already-kept best.","next_action_hint":"Retain documented unsafe add_child implementation; profile expansion to verify the intermediate Node copy disappeared."}}
{"run":139,"commit":"81369a3","metric":914835.279,"metrics":{"ttt_empty_ns":1321479.875,"ttt_mid_ns":289682.625,"uttt_empty_ns":1004272.4,"uttt_mid_ns":920879.45,"deep_chain_ns":3917480.792,"wide_512_ns":422681.5,"uttt_rollout_ns":4186.209,"uttt_step_ns":15.628},"status":"keep","description":"Mutate expansion child states directly in arena nodes","timestamp":1785193462938,"segment":4,"confidence":7.414328315007144,"asi":{"hypothesis":"After direct arena initialization, cloning the parent state into the final Node slot and applying step_in_place there can eliminate UTTT's 44-byte out-of-place step result and copy during every child expansion.","finding":"Primary improved 1.88%; UTTT empty/mid improved 8.7%/9.0%, while TTT was near flat. Generic deep/wide regressed 2.0%/4.4% because their default step_in_place performs clone-plus-step without bundled in-place specialization.","mechanism":"Each Node is initialized once in final arena storage, then its state field is mutated in place. State's documented step_in_place hook preserves compatible default behavior.","next_action_hint":"Confirm UTTT gains; investigate a trait default or expansion hook that preserves direct bundled construction without generic deep/wide clone overhead."}}
{"run":140,"commit":"da59769","metric":895365.783,"metrics":{"ttt_empty_ns":1307955.792,"ttt_mid_ns":286131.391,"uttt_empty_ns":998106.45,"uttt_mid_ns":922789.4,"deep_chain_ns":3705258.75,"wide_512_ns":403409.75,"uttt_rollout_ns":4199.215,"uttt_step_ns":16.117},"status":"keep","description":"Opt bundled states into in-place expansion construction","timestamp":1785193557633,"segment":4,"confidence":7.933799377120971,"asi":{"hypothesis":"A default-false associated State capability can compile bundled states to direct in-arena mutation while preserving the original step path and clone behavior for generic states.","finding":"Primary improved 2.13%; deep recovered/improved 5.4%, wide 4.6%, TTT about 1%, while UTTT retained its prior 9% direct-construction gain. Full checks pass.","mechanism":"Monomorphization removes the capability branch. Opted-in bundled Copy states clone into final Node storage and mutate there; external states default to parent_state.step exactly as before.","next_action_hint":"Retain capability-gated expansion. Consider whether its name/docs should be refined at finalization, not as a performance experiment."}}
{"run":141,"commit":"da59769","metric":904992.679,"metrics":{"ttt_empty_ns":1332224.417,"ttt_mid_ns":287694.5,"uttt_empty_ns":1001074.4,"uttt_mid_ns":925312.35,"deep_chain_ns":3752579.25,"wide_512_ns":412360.312,"uttt_rollout_ns":4189.22,"uttt_step_ns":16.106},"status":"discard","description":"Return newly initialized arena child by mutable reference","timestamp":1785193629186,"segment":4,"confidence":7.879423512290157,"asi":{"hypothesis":"Returning the newly initialized Node directly can avoid a second arena index/bounds lookup before in-place state mutation.","finding":"Every core workload regressed 0.3-2.2%, primary 1.1%. Returning a mutable reference changes helper ABI/alias codegen more than it saves.","rollback_reason":"Primary and all core metrics regressed.","next_action_hint":"Keep add_child returning a compact ID and reacquire the Node explicitly; this yields better alias optimization."}}
{"run":142,"commit":"da59769","metric":909161.387,"metrics":{"ttt_empty_ns":1354355.083,"ttt_mid_ns":286402.016,"uttt_empty_ns":998829.9,"uttt_mid_ns":925870.35,"deep_chain_ns":3713868.208,"wide_512_ns":423905.531,"uttt_rollout_ns":4172.612,"uttt_step_ns":10.772},"status":"discard","description":"Apply known-legal transition during direct child construction","timestamp":1785193685740,"segment":4,"confidence":8.397244698771797,"asi":{"hypothesis":"Direct child construction consumes generated legal actions, so step_legal_in_place can skip UTTT duplicate recount and use its one-player winner path in final arena storage.","finding":"UTTT remained roughly flat, while TTT empty regressed 3.5%, wide 5.1%, and primary 1.5%. The additional default-hook layer/code layout outweighs tiny checked-transition savings.","rollback_reason":"Primary and important core workloads regressed.","next_action_hint":"Keep ordinary step_in_place for expansion even with known legal actions; reserve step_legal for repeated rollouts."}}
{"run":143,"commit":"da59769","metric":932027.208,"metrics":{"ttt_empty_ns":1326151.083,"ttt_mid_ns":312810.281,"uttt_empty_ns":1020997.75,"uttt_mid_ns":938645.3,"deep_chain_ns":3774695.708,"wide_512_ns":436806.688,"uttt_rollout_ns":4129.605,"uttt_step_ns":15.967},"status":"discard","description":"Batch ThreadRng words into a per-search buffer","timestamp":1785194001218,"segment":4,"confidence":7.949467580905262,"asi":{"hypothesis":"Perf now attributes most UTTT cycles to ThreadRng's per-word buffer/index path; prefetching 64 words through fill_bytes can amortize that machinery while preserving the same generator and uniform sampling.","finding":"Primary regressed 4.1%; TTT mid 9.3%, UTTT 2-2.4%, wide 8.3%. Local-buffer checks/copies and altered interleaving/advance of ThreadRng outweigh reduced handle machinery.","rollback_reason":"Primary and all targeted searches regressed; an additional unsafe buffer adapter is unjustified.","next_action_hint":"Keep direct ThreadRng consumption. Faster RNG remains best exposed through a caller-configurable API rather than hidden buffering."}}
{"run":144,"commit":"da59769","metric":909117.457,"metrics":{"ttt_empty_ns":1330949.958,"ttt_mid_ns":289912.859,"uttt_empty_ns":1018996.1,"uttt_mid_ns":948359.05,"deep_chain_ns":3786546.583,"wide_512_ns":399854.656,"uttt_rollout_ns":4482.448,"uttt_step_ns":16.128},"status":"discard","description":"Cache UTTT per-board empty counts in spare mask bits","timestamp":1785194098599,"segment":4,"confidence":7.7813248475962435,"asi":{"hypothesis":"Each u16 mini-board has seven spare bits; caching its 0-9 empty count there can remove bit-count table lookups from the now-dominant random selector without increasing State or Node size.","finding":"UTTT searches regressed 2.1-2.8%, rollout 8.5%, and primary 1.5%. Maintaining counts and masking winner indices costs more than hot compact table lookups.","rollback_reason":"Primary and all targeted UTTT workloads regressed.","next_action_hint":"Keep per-board empty counts derived from the 512-byte table; spare-bit metadata maintenance is consistently harmful."}}
{"run":145,"commit":"da59769","metric":908697.727,"metrics":{"ttt_empty_ns":1339857.417,"ttt_mid_ns":288010.703,"uttt_empty_ns":1021727.1,"uttt_mid_ns":939915.1,"deep_chain_ns":3795791.583,"wide_512_ns":400242.812,"uttt_rollout_ns":4198.107,"uttt_step_ns":16.771},"status":"discard","description":"Hoist in-place expansion capability outside action loop","timestamp":1785194143196,"segment":4,"confidence":7.940225289827326,"asi":{"hypothesis":"Duplicating the expansion loop around the monomorphized capability constant may remove merge/control structure from each specialized hot loop.","finding":"Primary regressed 1.5%; UTTT 2.3%, TTT empty 2.4%, deep 2.4%. LLVM generates better layout from the compact inner constant branch, which it already folds.","rollback_reason":"Primary and most core workloads regressed.","next_action_hint":"Keep the capability condition inside the single action loop."}}
