{"run":40,"commit":"9c339de","metric":155705.941,"metrics":{"ttt_empty_ns":1573917.75,"ttt_mid_ns":316425.234,"uttt_empty_ns":1910276.15,"uttt_mid_ns":2251040.05,"deep_chain_ns":5523551.125,"wide_512_ns":603039.062,"uttt_rollout_ns":4242.48,"uttt_step_ns":11.416},"status":"keep","description":"Apply rollout actions in place through an optional State fast path","timestamp":1785186805000,"segment":1,"confidence":17.34128207330499,"asi":{"hypothesis":"Rollouts can mutate their scratch state directly, avoiding a 44-byte UTTT return copy and function prologue/epilogue on every ply while a default method preserves external State compatibility.","result":"Primary improved 2.5%; UTTT empty search improved 26%, midgame 2.2%, and direct step 12%. Synthetic wide regressed 16%, deep 4%, and legacy external rollout 10%, indicating default-method call overhead and changed out-of-place codegen.","mechanism":"Mcts simulation calls `step_in_place`; bundled Copy states override it, while `step` now copies once and delegates to the same mutation logic to keep semantics unified.","next_action_hint":"Inline the default `step_in_place` implementation so external/synthetic states compile back to the old assignment path and recover tree benchmarks."}}
{"run":41,"commit":"5da627b","metric":152707.831,"metrics":{"ttt_empty_ns":1554629.5,"ttt_mid_ns":313653.047,"uttt_empty_ns":1877750.3,"uttt_mid_ns":1700287.95,"deep_chain_ns":5323537.292,"wide_512_ns":519303.969,"uttt_rollout_ns":4026.71,"uttt_step_ns":17.064},"status":"keep","description":"Inline the compatible default in-place state transition","timestamp":1785186828140,"segment":1,"confidence":12.829683363091785,"asi":{"hypothesis":"Inlining State's default step-in-place assignment should erase abstraction overhead for external/synthetic implementations while bundled states retain specialized mutation.","result":"Primary improved 1.9%; wide recovered 13.9%, deep 3.6%, UTTT midgame 24.5%, and all end-to-end searches improved. Direct out-of-place UTTT step moved slower from code-layout effects, but production in-place search gains are broad.","mechanism":"Generic default implementations now monomorphize to the original `state = state.step(action)` sequence with no extra call boundary.","behavior_preserved":"External State implementations need no changes; all tests pass."}}
{"run":42,"commit":"5da627b","metric":152049.696,"metrics":{"ttt_empty_ns":1613673.708,"ttt_mid_ns":323627.672,"uttt_empty_ns":1982283.65,"uttt_mid_ns":1763297,"deep_chain_ns":5581785.625,"wide_512_ns":520016.75,"uttt_rollout_ns":3837.114,"uttt_step_ns":14.052},"status":"discard","description":"Duplicate out-of-place step bodies alongside rollout mutation fast paths","timestamp":1785186867936,"segment":1,"confidence":10.11794106689432,"asi":{"hypothesis":"Keeping dedicated out-of-place step code should recover direct State API and legacy rollout performance while specialized in-place methods serve Mcts simulation.","finding":"Direct UTTT step improved 18% and external rollout 4.7%, but all four end-to-end searches regressed 3.8-5.6% and deep-chain 4.9%; the apparent 0.4% primary gain overweights microbench code-layout movement.","rollback_reason":"Keeping duplicate implementations would overfit microbenchmarks while degrading every main user search workload and increasing maintenance risk.","next_action_hint":"Retain unified step semantics through step_in_place; optimize the mutating implementation itself rather than duplicating large out-of-place code."}}
{"run":43,"commit":"5da627b","metric":150377.063,"metrics":{"ttt_empty_ns":1677624.083,"ttt_mid_ns":334228.078,"uttt_empty_ns":1940455.9,"uttt_mid_ns":1800004.75,"deep_chain_ns":5617509.542,"wide_512_ns":519915.188,"uttt_rollout_ns":4267.157,"uttt_step_ns":10.713},"status":"discard","description":"Use default in-place transition for compact Tic-Tac-Toe","timestamp":1785186904950,"segment":1,"confidence":9.709422479181903,"asi":{"hypothesis":"A 6-byte TTT state returns in registers, so its explicit mutation override may be unnecessary; the inline default can retain old codegen.","finding":"Both targeted TTT searches regressed 6-8%, every other search except wide regressed, and only an unrelated UTTT step code-layout swing made primary appear 1.5% better.","rollback_reason":"The apparent primary win is non-causal benchmark noise; production end-to-end performance broadly degraded, so keeping it would overfit.","next_action_hint":"Retain explicit in-place implementations for both bundled states and treat nanosecond UTTT step swings cautiously when unrelated source layout changes."}}
{"run":44,"commit":"5da627b","metric":155514.153,"metrics":{"ttt_empty_ns":1574734.75,"ttt_mid_ns":314341.156,"uttt_empty_ns":1855060.4,"uttt_mid_ns":1684128,"deep_chain_ns":5434369.375,"wide_512_ns":527431.094,"uttt_rollout_ns":3984.459,"uttt_step_ns":19.37},"status":"discard","description":"Update only the relevant UTTT macro-board winner in place","timestamp":1785186950149,"segment":1,"confidence":9.332612071044093,"asi":{"hypothesis":"Only the moving player can create a new mini-board win; tracking an existing X win preserves X-first semantics while avoiding the second lookup and helper plumbing.","finding":"UTTT searches improved about 1%, but direct step regressed 13.5%, other workloads were flat-to-worse, and primary regressed 1.8%. Branch structure/codegen outweighed one removed table load.","rollback_reason":"Primary regressed and the subtle priority logic adds complexity without a robust hot-path win.","next_action_hint":"Keep the simple two-table-check helper; most step cost is state copying/return ABI rather than win lookup."}}
{"run":45,"commit":"5da627b","metric":150118.309,"metrics":{"ttt_empty_ns":1576053.875,"ttt_mid_ns":317540.047,"uttt_empty_ns":1900464.1,"uttt_mid_ns":1718369.25,"deep_chain_ns":5418427.333,"wide_512_ns":519613.312,"uttt_rollout_ns":4081.037,"uttt_step_ns":13.734},"status":"discard","description":"Expose UTTT in-place transition for cross-crate inlining","timestamp":1785186988198,"segment":1,"confidence":9.197771792611839,"asi":{"hypothesis":"The 254-byte mutating transition should inline more successfully than the old 393-byte returning step, removing a call per UTTT rollout ply.","finding":"Direct step improved 19.5%, but both targeted UTTT searches regressed about 1%, TTT/deep also regressed, and only wide stayed flat; the 1.7% aggregate improvement is driven by the microbenchmark rather than production search.","rollback_reason":"Inlining did not improve the intended simulation caller, so keeping it would optimize a secondary code-layout artifact while broadly degrading end-to-end workloads.","next_action_hint":"Leave UTTT step_in_place out of line; the remaining call is cheaper than increased simulation-loop instruction footprint."}}
{"run":46,"commit":"5da627b","metric":144013.867,"metrics":{"ttt_empty_ns":1588692.958,"ttt_mid_ns":328719.031,"uttt_empty_ns":1836524.5,"uttt_mid_ns":1668146,"deep_chain_ns":5316077.875,"wide_512_ns":522028.312,"uttt_rollout_ns":3989.248,"uttt_step_ns":10.446},"status":"discard","description":"Pass one reusable RNG handle through each search and rollout","timestamp":1785187075784,"segment":1,"confidence":9.066772442027233,"asi":{"hypothesis":"Fresh ThreadRng handle lookup now accounts for 6.7% of profiled UTTT cycles, so passing one handle through random child and action selection should remove TLS overhead.","finding":"UTTT searches improved about 2%, but TTT searches regressed 2-5% and synthetic workloads were flat. The apparent 5.7% primary win came almost entirely from an unrelated 39% UTTT step code-layout swing; the geometric mean of the four actual search workloads was slightly worse.","rollback_reason":"Keeping would overfit an unrelated nanosecond microbenchmark artifact; the intended production change was a net tradeoff rather than a broad improvement.","next_action_hint":"ThreadRng TLS overhead is real in profiles, but eliminating it requires a lower-code-size RNG path or explicit caller-owned RNG API rather than retaining a handle in the current search loop."}}
{"run":47,"commit":"5da627b","metric":153158.696,"metrics":{"ttt_empty_ns":1593185,"ttt_mid_ns":353405.906,"uttt_empty_ns":1759277.95,"uttt_mid_ns":1595132.5,"deep_chain_ns":4570192.083,"wide_512_ns":535355.688,"uttt_rollout_ns":4019.615,"uttt_step_ns":19.485},"status":"discard","description":"Use a per-search SmallRng for random child and rollout choices","timestamp":1785187146653,"segment":1,"confidence":8.616787666074105,"asi":{"hypothesis":"Seeding a fast SmallRng once per search should remove ThreadRng TLS/ChaCha costs while retaining uniform choices and adequate MCTS randomness.","finding":"UTTT searches improved 6-7% and deep-chain 14%, but TTT midgame regressed 13%, empty 2.5%, wide 3%, and primary regressed 0.3%. Different stochastic tree growth plus setup/code-size tradeoffs prevent a broad default win.","rollback_reason":"Primary did not improve and changing the default random stream produced a significant TTT workload regression despite other gains.","next_action_hint":"A caller-configurable RNG could be a future API feature, but keep ThreadRng semantics/default for this performance pass."}}
{"run":48,"commit":"5da627b","metric":155500.014,"metrics":{"ttt_empty_ns":1588730.833,"ttt_mid_ns":320208.766,"uttt_empty_ns":1894123.55,"uttt_mid_ns":1733007.6,"deep_chain_ns":5476763,"wide_512_ns":516757.375,"uttt_rollout_ns":4033.045,"uttt_step_ns":17.935},"status":"discard","description":"Skip q recomputation when a node's reward already equals its mean","timestamp":1785187193042,"segment":1,"confidence":8.260945520089717,"asi":{"hypothesis":"When reward equals q, adding another identical sample leaves the mean unchanged; skipping division should especially accelerate draw-only chain/wide trees.","finding":"Deep-chain regressed 2.9% and all end-to-end searches regressed 1-2%; the per-node floating comparison/branch costs more than division in the memory-bound backprop loop. Wide was only 0.5% better.","rollback_reason":"Primary regressed 1.8% with no broad gain.","next_action_hint":"Keep unconditional q recomputation; backprop is cache/stride-bound enough that adding branches to save arithmetic is counterproductive."}}
{"run":49,"commit":"9c7519e","metric":142988.667,"metrics":{"ttt_empty_ns":1531077.417,"ttt_mid_ns":292769.406,"uttt_empty_ns":1905056,"uttt_mid_ns":1724670.1,"deep_chain_ns":5339385.917,"wide_512_ns":528670.094,"uttt_rollout_ns":3988.259,"uttt_step_ns":10.539},"status":"keep","description":"Skip terminal checks on already-expanded selection nodes","timestamp":1785187233052,"segment":1,"confidence":8.296755590971106,"asi":{"hypothesis":"Terminal nodes are never expanded, so any node with children is necessarily non-terminal; selection can stop solely on leaf status and avoid state terminal checks at every tree level.","result":"Primary improved 6.4%; TTT empty/mid searches improved 1.5%/6.7%, deep was flat, while UTTT and wide moved about 1-2% worse amid a large unrelated step code-layout gain.","mechanism":"Selection no longer performs two win-table loads (or generic State terminal logic) on every previously expanded node along the path.","invariant":"Expansion is guarded by `!state.is_terminal()` and terminal nodes never receive children; the existing invariant suite verifies this across all games. Tests pass."}}
{"run":50,"commit":"9c7519e","metric":144455.655,"metrics":{"ttt_empty_ns":1537404.042,"ttt_mid_ns":292189.719,"uttt_empty_ns":1929441.35,"uttt_mid_ns":1731941.55,"deep_chain_ns":5465924.292,"wide_512_ns":520862.031,"uttt_rollout_ns":4004.669,"uttt_step_ns":11.079},"status":"discard","description":"Move the owned root state directly into its node after further hot-loop gains","timestamp":1785187262674,"segment":1,"confidence":8.062507452982368,"asi":{"hypothesis":"After major hot-loop reductions, the redundant Mcts::new state clone might become measurable, especially for external large states.","finding":"As in the earlier attempt, bundled searches were flat-to-worse and primary regressed 1.0%; compact Copy states make construction clone negligible.","rollback_reason":"Primary did not improve; retain current code to avoid accepting noise despite the apparent cleanup.","next_action_hint":"Root construction is not a useful target for bundled workloads; focus on per-iteration paths."}}
{"run":51,"commit":"e427df0","metric":138959.93,"metrics":{"ttt_empty_ns":1519676.625,"ttt_mid_ns":294428.922,"uttt_empty_ns":1656737.5,"uttt_mid_ns":1502908,"deep_chain_ns":5464654.667,"wide_512_ns":526892.906,"uttt_rollout_ns":3975.727,"uttt_step_ns":10.902},"status":"keep","description":"Use a compact uniform sampler for bundled rollout choices","timestamp":1785187331980,"segment":1,"confidence":8.030766306054147,"asi":{"hypothesis":"Profiled UTTT random selection is dominated by generic gen_range code; a concrete Lemire multiply-high sampler can preserve exact uniformity with much smaller code.","result":"Primary improved 2.8%; UTTT empty/mid searches improved 13.0%/12.9%, TTT was roughly flat, and unrelated synthetic metrics moved about 0-2%.","mechanism":"A shared concrete `random_below(u32)` draws one ThreadRng word and uses rejection-corrected multiply-high reduction, avoiding large generic UniformInt monomorphizations in both game selectors.","correctness":"The rejection threshold removes modulo bias, action ordering and distributions remain uniform, and all deterministic/statistical tests pass."}}
{"run":52,"commit":"e427df0","metric":140447.943,"metrics":{"ttt_empty_ns":1526684.958,"ttt_mid_ns":297732.188,"uttt_empty_ns":1702473.75,"uttt_mid_ns":1560199.15,"deep_chain_ns":5351639.083,"wide_512_ns":534576.594,"uttt_rollout_ns":4046.78,"uttt_step_ns":10.831},"status":"discard","description":"Fast-path one-child expansion and use compact sampling for sibling choice","timestamp":1785187410731,"segment":1,"confidence":7.701782999431034,"asi":{"hypothesis":"Expanded-child selection can skip randomness for one child and reuse compact uniform reduction for practical sibling counts, removing generic SliceRandom overhead once per iteration.","finding":"Deep-chain improved 2.1%, but all end-to-end searches regressed 0.5-4%, wide regressed 1.5%, and primary worsened 1.1%. Rollout dominates rich games and the extra match/conversion code costs more than child-choice savings.","rollback_reason":"Primary regressed and only the synthetic single-child shape benefited.","next_action_hint":"Keep SliceRandom for expansion; its once-per-iteration cost is minor compared with per-ply rollout sampling."}}
{"run":53,"commit":"e427df0","metric":142120.687,"metrics":{"ttt_empty_ns":1571058,"ttt_mid_ns":301066.531,"uttt_empty_ns":1732179.5,"uttt_mid_ns":1566931.6,"deep_chain_ns":5502957.25,"wide_512_ns":535261.625,"uttt_rollout_ns":4054.579,"uttt_step_ns":10.856},"status":"discard","description":"Use maintained occupancy for unrestricted UTTT sample bounds after sampler optimization","timestamp":1785187458751,"segment":1,"confidence":7.447367633496875,"asi":{"hypothesis":"After compacting random reduction, replacing the initial nine-board popcount with the exact occupied counter should remove a visible SIMD counting block from the selector.","finding":"Both targeted UTTT searches regressed 4-5% and primary worsened 2.3%. LLVM's vectorized board popcount is cheap and also prepares data used to locate the sampled board, while the counter path does not help subsequent scans.","rollback_reason":"Primary and targeted workloads regressed materially.","next_action_hint":"Retain vectorized per-board empty counting; the occupied counter is useful for terminal detection but not this selector."}}
{"run":54,"commit":"79bca61","metric":133453.806,"metrics":{"ttt_empty_ns":1534637.792,"ttt_mid_ns":295325.016,"uttt_empty_ns":1433830.4,"uttt_mid_ns":1314733.7,"deep_chain_ns":5417416.958,"wide_512_ns":524428.25,"uttt_rollout_ns":3958.687,"uttt_step_ns":10.471},"status":"keep","description":"Lookup the nth empty UTTT cell from its 9-bit mask","timestamp":1785187502465,"segment":1,"confidence":7.38416620378036,"asi":{"hypothesis":"There are only 512 mini-board masks and nine possible ranks, so a 4.5 KiB L1-resident table can replace the variable clear-low-bits loop in every UTTT random move.","result":"Primary improved 4.0%; UTTT empty/mid searches improved 13.5%/12.5%, while TTT, synthetic trees, external rollout, and step stayed within about 0-2%.","mechanism":"A compile-time 512x9 byte table maps `(empty_mask, uniform_rank)` directly to cell index; no unsafe BMI2 dispatch or variable loop is needed.","correctness":"The table is generated by ascending trailing-zero enumeration, exactly matching prior action rank order; all tests pass."}}
{"run":55,"commit":"79bca61","metric":133774.061,"metrics":{"ttt_empty_ns":1500926.292,"ttt_mid_ns":292327.516,"uttt_empty_ns":1421588.5,"uttt_mid_ns":1297366.25,"deep_chain_ns":5462065.833,"wide_512_ns":533035.688,"uttt_rollout_ns":3993.368,"uttt_step_ns":10.901},"status":"discard","description":"Share the nth-bit lookup with Tic-Tac-Toe random selection","timestamp":1785187556346,"segment":1,"confidence":7.275805945353341,"asi":{"hypothesis":"Sharing UTTT's 4.5 KiB rank table lets TTT replace its nine-cell branch scan without adding another table, while UTTT code remains equivalent.","finding":"All four end-to-end searches improved 0.8-2.2%, but unrelated synthetic/step movement left primary 0.24% worse, within noise.","rollback_reason":"Primary did not improve under the fixed rule despite favorable targeted metrics; confirmation is needed.","next_action_hint":"Reapply and remeasure once; keep if broad search gains repeat and the aggregate crosses the noise floor."}}
{"run":56,"commit":"eab7301","metric":130931.56,"metrics":{"ttt_empty_ns":1469805.25,"ttt_mid_ns":290125.188,"uttt_empty_ns":1392041.7,"uttt_mid_ns":1277552.4,"deep_chain_ns":5350515.25,"wide_512_ns":521600.75,"uttt_rollout_ns":3992.776,"uttt_step_ns":10.22},"status":"keep","description":"Share rank lookup across both bundled game selectors","timestamp":1785187609279,"segment":1,"confidence":7.230489791055395,"asi":{"hypothesis":"One shared 9-bit rank table can remove TTT's cell scan at no additional cache footprint while preserving UTTT's prior win.","result":"Confirmation improved primary 1.9%; TTT empty/mid improved 4.2%/1.8%, UTTT 2-3%, synthetic trees 1-2%, and step 2.4%.","mechanism":"The compile-time table and nth-set-bit helper moved to the shared games module; both selectors map a uniform rank directly to an ascending empty cell.","confidence_note":"A first run had the same broad search direction but aggregate was 0.24% worse from noise; the clean confirmation supports keeping. All tests pass."}}
{"run":57,"commit":"eab7301","metric":135474.679,"metrics":{"ttt_empty_ns":1518664.125,"ttt_mid_ns":302609.484,"uttt_empty_ns":1440017.4,"uttt_mid_ns":1306038.7,"deep_chain_ns":5405512.375,"wide_512_ns":523130.75,"uttt_rollout_ns":3985.154,"uttt_step_ns":11.649},"status":"discard","description":"Share one win table between bundled games","timestamp":1785187677036,"segment":1,"confidence":7.147999063648844,"asi":{"hypothesis":"Both games use identical 9-bit win patterns, so one shared 512-byte table should reduce data footprint and L1 pressure.","finding":"All four searches regressed 2-4%, direct step 14%, and primary 3.5%. The compiler/linker likely already merges constants, while the shared helper changes inlining/code placement unfavorably.","rollback_reason":"Primary and every targeted search workload regressed.","next_action_hint":"Keep per-module win tables so each hot implementation gets local direct indexing; source duplication is intentional for codegen locality."}}
{"run":58,"commit":"eab7301","metric":134119.409,"metrics":{"ttt_empty_ns":1483100.583,"ttt_mid_ns":285386.625,"uttt_empty_ns":1432552.45,"uttt_mid_ns":1312398.65,"deep_chain_ns":5703090.458,"wide_512_ns":521482.625,"uttt_rollout_ns":4039.113,"uttt_step_ns":10.953},"status":"discard","description":"Reserve each expansion's exact arena growth before pushing children","timestamp":1785187725760,"segment":1,"confidence":7.067369333982097,"asi":{"hypothesis":"Expansion knows exactly how many nodes it will append, so one reserve should prevent mid-batch arena growth and reduce push checks/reallocations.","finding":"TTT improved about 1-2%, but UTTT regressed 3%, deep-chain 6.6%, and primary 2.4%. Vec's amortized growth already handles batches well; calling reserve on every expansion adds overhead and changes small allocation behavior.","rollback_reason":"Primary and several important workloads regressed.","next_action_hint":"Do not reserve per expansion; arena growth is not a dominant cost after state compaction."}}
{"run":59,"commit":"eab7301","metric":131997.767,"metrics":{"ttt_empty_ns":1454370.333,"ttt_mid_ns":303365.578,"uttt_empty_ns":1368860.8,"uttt_mid_ns":1258986.55,"deep_chain_ns":5329401.958,"wide_512_ns":531639.125,"uttt_rollout_ns":4053.293,"uttt_step_ns":10.554},"status":"discard","description":"Append contiguous child IDs after creating an expansion batch","timestamp":1785187759710,"segment":1,"confidence":7.0294534857560995,"asi":{"hypothesis":"Children are created contiguously, so adding all nodes first and extending the parent range once should avoid one parent lookup and child push per action.","finding":"UTTT searches and TTT empty improved 1-2%, but TTT midgame regressed 4.6%, wide 1.9%, and primary 0.8%. Range extend's exact reserve/allocation behavior offsets fewer parent lookups on smaller trees.","rollback_reason":"Primary regressed and gains were not broad across branching shapes.","next_action_hint":"Keep simple interleaved child pushes; contiguous-range representation only pays with a true structural Node API change."}}
