{"run":81,"commit":"bf32aa1","metric":132724.143,"metrics":{"ttt_empty_ns":1523515.25,"ttt_mid_ns":314255.641,"uttt_empty_ns":1459784.15,"uttt_mid_ns":1315796.05,"deep_chain_ns":4357402.917,"wide_512_ns":514844.219,"uttt_rollout_ns":4203.596,"uttt_step_ns":11.104},"status":"discard","description":"Keep exclusive borrow through UCB child selection","timestamp":1785189317626,"segment":1,"confidence":11.29468873625654,"asi":{"hypothesis":"Using &mut self in get_best_child may retain Mcts no-alias guarantees through the UCB scan.","finding":"All end-to-end searches regressed 6-8%, primary 6.2%, and unrelated metrics moved slower. The mutable receiver inhibits the read-only scan optimizations more than no-alias helps.","rollback_reason":"Primary and target workloads regressed.","next_action_hint":"Keep select exclusive but get_best_child shared; the current borrow boundary gives best codegen."}}
{"run":82,"commit":"bf32aa1","metric":133361.545,"metrics":{"ttt_empty_ns":1505887.833,"ttt_mid_ns":310539.875,"uttt_empty_ns":1383340.65,"uttt_mid_ns":1289050.25,"deep_chain_ns":4245860.292,"wide_512_ns":525646,"uttt_rollout_ns":4511.08,"uttt_step_ns":11.918},"status":"discard","description":"Repeat unchanged best to quantify current benchmark drift","timestamp":1785189338770,"segment":1,"confidence":11.36739005643184,"asi":{"hypothesis":"Recent broad regressions may reflect system load rather than code changes; rerunning unchanged best estimates the current noise floor.","finding":"Unchanged code measured 6.7% slower than its kept run, with every metric slower and rollout 13% slower. The machine currently has high background load, so small recent candidate comparisons are not trustworthy against historical best.","rollback_reason":"No code change and primary is worse than the kept measurement.","next_action_hint":"Require large/targeted gains or paired confirmation while system load is elevated; consider pausing micro-optimizations and focus on structural changes."}}
{"type":"config","name":"Improve MCTS throughput and cache locality (fixed-work harness, uncontended core)","metricName":"geomean_ns","metricUnit":"ns","bestDirection":"lower"}
{"run":83,"commit":"d90de77","metric":129077.832,"metrics":{"ttt_empty_ns":1471687.667,"ttt_mid_ns":301916.656,"uttt_empty_ns":1388434.6,"uttt_mid_ns":1293118.75,"deep_chain_ns":4239284.917,"wide_512_ns":508505.188,"uttt_rollout_ns":4035.72,"uttt_step_ns":11.103},"status":"keep","description":"Reset optimized baseline on an uncontended physical core","timestamp":1785189393761,"segment":2,"confidence":null,"asi":{"hypothesis":"Pinning to CPU 6 avoids sustained work on CPU 0's SMT sibling and restores reliable paired comparisons for subsequent micro-optimizations.","measurement_change":"Workloads and metric are unchanged; only CPU affinity moved from logical CPU 0 to CPU 6 after unchanged code drifted 6.7% under contention.","historical_result":"Before reset, optimized code reached 124938ns on core 0, 71.3% below the original fixed-work baseline; latest full Criterion showed every search 66-82% faster and full games 68-77% faster than initial."}}
{"run":84,"commit":"d90de77","metric":133514.629,"metrics":{"ttt_empty_ns":1525548.958,"ttt_mid_ns":308895.203,"uttt_empty_ns":1429437.85,"uttt_mid_ns":1346690.9,"deep_chain_ns":4370202.833,"wide_512_ns":554728.312,"uttt_rollout_ns":4146.381,"uttt_step_ns":11.074},"status":"discard","description":"Repeat CPU 6 baseline to estimate residual noise","timestamp":1785189413880,"segment":2,"confidence":null,"asi":{"hypothesis":"A second unchanged run checks whether CPU 6 gives a sufficiently stable noise floor.","finding":"Unchanged primary was 3.4% slower and wide 9.1% slower; affinity avoids the known sibling but shared system/CCD load still causes material run-to-run variance.","rollback_reason":"No code change and metric did not improve.","next_action_hint":"Use targeted secondary consistency and confirmation for sub-5% candidates; prefer structural experiments."}}
{"type":"config","name":"Improve MCTS throughput and cache locality (nine-round stable harness)","metricName":"geomean_ns","metricUnit":"ns","bestDirection":"lower"}
{"run":85,"commit":"7876608","metric":135371.959,"metrics":{"ttt_empty_ns":1521943.583,"ttt_mid_ns":306436.641,"uttt_empty_ns":1383739.15,"uttt_mid_ns":1277185.3,"deep_chain_ns":4208883.458,"wide_512_ns":522356.312,"uttt_rollout_ns":4246.273,"uttt_step_ns":14.657},"status":"keep","description":"Establish nine-round baseline on CPU 6","timestamp":1785189468037,"segment":3,"confidence":null,"asi":{"hypothesis":"Nine batched medians reduce susceptibility to intermittent shared-system load while keeping iterations fast enough for autonomous research.","measurement_change":"Same eight workloads, budgets, CPU, and metric; rounds increased from five to nine. Baseline reset because estimator changed.","historical_result":"Production code is unchanged from the 71.3%-improved optimized state and latest Criterion cross-check remains 66-82% faster per search."}}
{"run":86,"commit":"3486a5f","metric":129997.286,"metrics":{"ttt_empty_ns":1485243.375,"ttt_mid_ns":308329.125,"uttt_empty_ns":1396787.05,"uttt_mid_ns":1291490.7,"deep_chain_ns":4286414.625,"wide_512_ns":510118.281,"uttt_rollout_ns":4144.714,"uttt_step_ns":10.894},"status":"keep","description":"Confirm nine-round baseline without code changes","timestamp":1785189487205,"segment":3,"confidence":null,"asi":{"hypothesis":"An immediate unchanged repeat estimates remaining variance after increasing rounds.","finding":"Primary moved 4.0% faster solely because nanosecond step changed 25%; end-to-end searches moved within -2.4% to +1.1%. The step microbenchmark remains code/alignment-sensitive even with nine rounds.","measurement_guidance":"Judge future candidates primarily by causal end-to-end/tree metrics; do not accept apparent wins driven only by UTTT step."}}
{"type":"config","name":"Improve core MCTS search and tree throughput","metricName":"geomean_ns","metricUnit":"ns","bestDirection":"lower"}
{"run":87,"commit":"69efad8","metric":1189582.212,"metrics":{"ttt_empty_ns":1524148.542,"ttt_mid_ns":298865.438,"uttt_empty_ns":1751407.8,"uttt_mid_ns":1617098.15,"deep_chain_ns":4210286.375,"wide_512_ns":521709.188,"uttt_rollout_ns":4143.96,"uttt_step_ns":14.974},"status":"keep","description":"Establish core-search geometric-mean baseline","timestamp":1785189537345,"segment":4,"confidence":null,"asi":{"hypothesis":"Excluding noisy nanosecond microbenchmarks from the primary aligns keep/discard with real end-to-end search and tree throughput while retaining rollout/step diagnostics.","measurement_change":"Primary now geometric-means the four search and two tree workloads; rollout and step remain secondary. Workloads, budgets, rounds, and affinity are unchanged.","historical_result":"Optimized implementation remains validated by Criterion at 66-82% faster search and 68-77% faster full games versus initial."}}
{"run":88,"commit":"1827289","metric":1109674.459,"metrics":{"ttt_empty_ns":1481423.833,"ttt_mid_ns":307017.094,"uttt_empty_ns":1394842.05,"uttt_mid_ns":1294043.2,"deep_chain_ns":4303856.167,"wide_512_ns":528445.375,"uttt_rollout_ns":4194.828,"uttt_step_ns":11.172},"status":"keep","description":"Confirm core-search baseline without code changes","timestamp":1785189563441,"segment":4,"confidence":null,"asi":{"hypothesis":"An unchanged repeat removes an unlucky first UTTT sample from the new primary baseline.","finding":"Primary improved 6.7% solely from UTTT returning to its established 1.3-1.4ms range; TTT/tree metrics moved within about 1-3%.","measurement_guidance":"Treat 1109674ns as the realistic core baseline and confirm future UTTT-sensitive changes because stochastic tree size remains the largest variance source."}}
{"run":89,"commit":"13df7dd","metric":1085378.915,"metrics":{"ttt_empty_ns":1446440.708,"ttt_mid_ns":297577.156,"uttt_empty_ns":1371944.75,"uttt_mid_ns":1259396.4,"deep_chain_ns":4197255.625,"wide_512_ns":523749.438,"uttt_rollout_ns":4115.958,"uttt_step_ns":13.905},"status":"keep","description":"Read compact child length directly for leaf checks","timestamp":1785189599302,"segment":4,"confidence":4.288988013604472,"asi":{"hypothesis":"Node and Children share a module, so leaf checks can read the tagged list length directly instead of dereferencing and constructing a slice at every selection depth.","result":"Primary improved 2.2%; all six core workloads improved 0.9-3.1%, providing a consistent causal signal.","mechanism":"`is_leaf` now compares the stored length word to zero; slice construction remains only for actual child traversal. Full tests pass."}}
{"run":90,"commit":"13df7dd","metric":1143670.338,"metrics":{"ttt_empty_ns":1465928.958,"ttt_mid_ns":309014.891,"uttt_empty_ns":1577225.4,"uttt_mid_ns":1423357.35,"deep_chain_ns":4261754.375,"wide_512_ns":516317.312,"uttt_rollout_ns":4137.386,"uttt_step_ns":11.321},"status":"discard","description":"Return inline single children before constructing slices","timestamp":1785189655410,"segment":4,"confidence":3.5752531551682893,"asi":{"hypothesis":"Compact Children stores one ID inline, so direct len/data access can bypass slice construction throughout narrow selection paths.","finding":"Deep-chain regressed 1.5%, UTTT 13-15%, TTT mid 3.8%, and primary 5.4%. The extra Option/branch perturbs the common multi-child path; compiler already optimizes the slice fast path.","rollback_reason":"Primary and most core workloads regressed materially.","next_action_hint":"Keep only direct zero-length leaf checks; do not add a separate one-child branch before split_first."}}
{"run":91,"commit":"13df7dd","metric":1107677.637,"metrics":{"ttt_empty_ns":1471587.208,"ttt_mid_ns":302204,"uttt_empty_ns":1437188.3,"uttt_mid_ns":1329082,"deep_chain_ns":4187029.833,"wide_512_ns":519305.125,"uttt_rollout_ns":4184.083,"uttt_step_ns":16.763},"status":"discard","description":"Remove bounds checks from 9-bit lookup tables","timestamp":1785189712160,"segment":4,"confidence":4.288988013604472,"asi":{"hypothesis":"All table inputs are masked 9-bit values and valid sampled ranks, so unchecked lookup could remove bounds branches from every rollout action.","finding":"All four searches regressed 1.5-5.5%, primary 2.1%; tree metrics improved slightly but are unaffected and therefore noise. Bounds checks are optimized/predictable and unchecked access harms codegen.","rollback_reason":"Primary and targeted random-selection workloads regressed; unsafe code has no measured justification.","next_action_hint":"Keep safe table indexing."}}
{"run":92,"commit":"584bf39","metric":1059018.271,"metrics":{"ttt_empty_ns":1422212.542,"ttt_mid_ns":298863.25,"uttt_empty_ns":1392808.55,"uttt_mid_ns":1273366.35,"deep_chain_ns":4164837.083,"wide_512_ns":449304.625,"uttt_rollout_ns":4255.845,"uttt_step_ns":14.139},"status":"keep","description":"Scan contiguous arena children directly in cached UCB selection","timestamp":1785189755018,"segment":4,"confidence":4.479696472669752,"asi":{"hypothesis":"Now that Nodes and child lists are compact, the verified contiguous child range can drive a direct arena slice scan, eliminating boxed child-ID loads and exposing sequential prefetch.","result":"Primary improved 2.4%; wide-512 improved 14.2%, TTT empty 1.7%, deep 0.8%. TTT mid and UTTT moved 0-1.5% slower.","mechanism":"Internal Mcts selection maps child offset directly to arena index and iterates adjacent Nodes. The public Node method retains generic ID-list behavior; a debug assertion verifies contiguity.","invariant":"Expansion creates the complete child batch consecutively before assigning Children, and no later node insertion changes IDs. Full tests pass."}}
{"run":93,"commit":"55ec43b","metric":1042890.082,"metrics":{"ttt_empty_ns":1412147.625,"ttt_mid_ns":296737.953,"uttt_empty_ns":1389519.1,"uttt_mid_ns":1251299.5,"deep_chain_ns":4135461.458,"wide_512_ns":427000.375,"uttt_rollout_ns":4142.572,"uttt_step_ns":19.27},"status":"keep","description":"Overlap score loads in pairs during contiguous UCB scans","timestamp":1785189799694,"segment":4,"confidence":4.075607718353798,"asi":{"hypothesis":"Scoring two adjacent Nodes before updating the running maximum can overlap independent q/visit loads and arithmetic while preserving sequential last-equal comparisons.","result":"Primary improved 1.5%; all six core workloads improved 0.2-5.0%, led by wide-512 at 5%.","mechanism":"The direct arena slice is consumed with chunks_exact(2); both scores are computed before ordered comparisons, exposing memory-level parallelism without changing tie order.","correctness":"Odd remainders are compared last and partial_cmp panic behavior is unchanged. Full tests pass."}}
{"run":94,"commit":"55ec43b","metric":1064799.623,"metrics":{"ttt_empty_ns":1381281.583,"ttt_mid_ns":306007.422,"uttt_empty_ns":1364786.75,"uttt_mid_ns":1273228.85,"deep_chain_ns":4896622.417,"wide_512_ns":405252.094,"uttt_rollout_ns":4133.252,"uttt_step_ns":20.456},"status":"discard","description":"Unroll contiguous UCB scoring four children at a time","timestamp":1785189850462,"segment":4,"confidence":4.237289809978679,"asi":{"hypothesis":"Four independent adjacent child scores may expose more load/arithmetic parallelism than pairwise unrolling.","finding":"Wide improved another 5.1% and some searches 1-2%, but deep-chain regressed 18%, TTT mid 3%, and primary 2.1%. Larger unrolled code damages instruction layout/common narrow paths.","rollback_reason":"Primary regressed materially; pairwise unrolling offers the better balance.","next_action_hint":"Keep chunks of two; four-wide unrolling is only attractive for a separately specialized very-wide path."}}
{"run":95,"commit":"55ec43b","metric":1107645.939,"metrics":{"ttt_empty_ns":1448587.833,"ttt_mid_ns":331688.812,"uttt_empty_ns":1427182.85,"uttt_mid_ns":1346910.9,"deep_chain_ns":4405120.583,"wide_512_ns":453893.344,"uttt_rollout_ns":4274.247,"uttt_step_ns":16.018},"status":"discard","description":"Dispatch very wide UCB scans to an out-of-line four-way loop","timestamp":1785189894060,"segment":4,"confidence":4.072021576265578,"asi":{"hypothesis":"An out-of-line >=64-child specialization can retain pairwise code locality for normal trees while exploiting four-way loads for very wide scans.","finding":"Every core workload regressed 2.6-12%, including wide by 6.3%; primary worsened 6.2%. Dispatch/call boundaries and duplicated scoring code hurt more than unrolling helps.","rollback_reason":"Primary and all core metrics regressed.","next_action_hint":"Keep one inline pairwise scan; do not specialize by width."}}
{"run":96,"commit":"55ec43b","metric":1084416.749,"metrics":{"ttt_empty_ns":1455629,"ttt_mid_ns":302494.469,"uttt_empty_ns":1484412.5,"uttt_mid_ns":1365882.25,"deep_chain_ns":4180092,"wide_512_ns":435768.125,"uttt_rollout_ns":4144.585,"uttt_step_ns":11.009},"status":"discard","description":"Use pairwise tournament maxima in UCB scans","timestamp":1785189941376,"segment":4,"confidence":6.537834700944627,"asi":{"hypothesis":"Selecting each pair's later-equal winner before comparing to the running best shortens the best-score dependency chain while preserving numeric max/tie semantics.","finding":"Wide regressed 2%, TTT 2-3%, UTTT 7-9%, and primary 4%. Reordering floating comparisons changes stochastic selection trajectories and does not improve branch dependency enough.","rollback_reason":"Primary and all end-to-end searches regressed.","next_action_hint":"Preserve strictly sequential first-then-second comparisons inside pairwise load unrolling."}}
{"run":97,"commit":"55ec43b","metric":1069788.011,"metrics":{"ttt_empty_ns":1375880.292,"ttt_mid_ns":303547.938,"uttt_empty_ns":1348341.45,"uttt_mid_ns":1324918.05,"deep_chain_ns":4289587.083,"wide_512_ns":468353.781,"uttt_rollout_ns":4217.008,"uttt_step_ns":17.315},"status":"discard","description":"Unroll backpropagation two levels at a time","timestamp":1785189998902,"segment":4,"confidence":6.578499431492063,"asi":{"hypothesis":"Updating two ancestors per loop can halve loop-control branches and expose more independent address work in backpropagation.","finding":"Deep-chain regressed 3.7%, wide 9.7%, TTT/UTTT midgame 2-6%, and primary 2.6%; only empty-board searches improved modestly. Larger inlined code harms common paths.","rollback_reason":"Primary and tree-operation workloads regressed materially.","next_action_hint":"Keep the compact one-node backprop loop; it is memory-bound and branch-predictable."}}
{"run":98,"commit":"55ec43b","metric":1054036.61,"metrics":{"ttt_empty_ns":1371775.125,"ttt_mid_ns":324384.656,"uttt_empty_ns":1238365.35,"uttt_mid_ns":1367504.65,"deep_chain_ns":4329936.208,"wide_512_ns":420273.344,"uttt_rollout_ns":4127.859,"uttt_step_ns":11.054},"status":"discard","description":"Drive compact rollout sampling from a per-search SmallRng","timestamp":1785190089788,"segment":4,"confidence":6.169181489477562,"asi":{"hypothesis":"Combining one fast SmallRng with the compact Lemire sampler should remove ThreadRng/TLS costs without reintroducing generic gen_range code.","finding":"TTT empty improved 2.9%, UTTT empty 10.9%, and wide 1.6%, but both midgames regressed 9.3%, deep 4.7%, and primary 1.1%. Different RNG trajectories remain a significant workload tradeoff.","rollback_reason":"Primary did not improve and midgame regressions are substantial; changing default RNG behavior is unjustified.","next_action_hint":"Keep ThreadRng and compact concrete sampling. Offer configurable RNG only as a future API feature."}}
{"run":99,"commit":"55ec43b","metric":1034928.021,"metrics":{"ttt_empty_ns":1425943.833,"ttt_mid_ns":325991.188,"uttt_empty_ns":1275918.5,"uttt_mid_ns":1174166.05,"deep_chain_ns":4309588.417,"wide_512_ns":409415.562,"uttt_rollout_ns":4131.865,"uttt_step_ns":10.93},"status":"discard","description":"Reuse one ThreadRng handle with compact sampling","timestamp":1785190153090,"segment":4,"confidence":5.807815910468535,"asi":{"hypothesis":"Passing one ThreadRng handle preserves the same generator/stream while removing per-ply TLS handle construction from compact sampling.","finding":"Primary improved only 0.76%; UTTT improved 6-8% and wide 4%, but TTT midgame regressed 10% and deep 4%. The aggregate win is below noise with a significant end-to-end tradeoff.","rollback_reason":"A small primary gain does not justify the 10% TTT midgame regression without confirmation.","next_action_hint":"Reapply once to confirm; keep only if UTTT gains repeat and TTT/deep regressions collapse as noise."}}
{"run":100,"commit":"b2bab8c","metric":1013487.957,"metrics":{"ttt_empty_ns":1378799.417,"ttt_mid_ns":309705.469,"uttt_empty_ns":1246958.55,"uttt_mid_ns":1158492.5,"deep_chain_ns":4212122.708,"wide_512_ns":417076.125,"uttt_rollout_ns":4083.522,"uttt_step_ns":17.735},"status":"keep","description":"Reuse one ThreadRng handle throughout compact rollouts","timestamp":1785190221848,"segment":4,"confidence":5.7623581909701596,"asi":{"hypothesis":"Passing one ThreadRng handle through child and action selection preserves the same underlying generator while eliminating repeated TLS/refcount handle construction.","result":"Confirmation improved primary 2.8%; UTTT empty/mid improved 10.3%/7.4%, TTT empty 2.4%, and wide 2.3%. TTT mid regressed 4.4% and deep 1.9%.","mechanism":"State's optional random-action method now accepts any Rng, bundled compact sampling consumes it directly, and Mcts creates one ThreadRng handle per search.","confidence_note":"A first run improved primary only 0.8% with noisier TTT/deep regressions; repeated UTTT/wide gains and stronger confirmation justify keeping. Full tests pass."}}
{"run":101,"commit":"b2bab8c","metric":1014510.634,"metrics":{"ttt_empty_ns":1367464.792,"ttt_mid_ns":305748.75,"uttt_empty_ns":1239551.05,"uttt_mid_ns":1152808,"deep_chain_ns":4165759.042,"wide_512_ns":438069.719,"uttt_rollout_ns":3998.964,"uttt_step_ns":10.798},"status":"discard","description":"Keep compact RNG reduction out of line","timestamp":1785190266820,"segment":4,"confidence":5.051471758884614,"asi":{"hypothesis":"Outlining generic random_below can share one ThreadRng specialization between games and shrink selector instruction footprints after handle reuse.","finding":"Five core workloads improved 0.5-1.3%, but wide regressed 5% and primary was 0.1% worse. Call overhead/code placement offsets smaller selectors.","rollback_reason":"Primary did not improve; keep compiler-selected inlining.","next_action_hint":"Leave random_below inlineable now that the RNG handle is reused."}}
{"run":102,"commit":"4927eea","metric":1000261.163,"metrics":{"ttt_empty_ns":1353536.042,"ttt_mid_ns":307346.531,"uttt_empty_ns":1244143.9,"uttt_mid_ns":1152301.45,"deep_chain_ns":4172882.042,"wide_512_ns":402447.719,"uttt_rollout_ns":4060.434,"uttt_step_ns":10.632},"status":"keep","description":"Apply UTTT moves with branchless player masks","timestamp":1785190326634,"segment":4,"confidence":5.206998610713798,"asi":{"hypothesis":"UTTT alternates the player branch every ply; mask-selecting the destination board can avoid branch/control overhead in both rollout and expansion transitions.","result":"Primary improved 1.3%; UTTT searches improved 0.2-0.5%, direct step 2.7%, TTT empty 1.8%, and wide 3.5%. TTT mid/deep regressed 0.5-1.5%.","mechanism":"A sign-expanded current-player mask routes the move bit to X or O with two AND/OR operations; the now-unused set_bit helper was removed. All tests pass."}}
