{"type":"config","name":"Improve MCTS vectorization, cache locality, and throughput","metricName":"geomean_ns","metricUnit":"ns","bestDirection":"lower"}
{"run":1,"commit":"a0e447c","metric":438066.15,"metrics":{"ttt_empty_ns":6280799.552,"ttt_mid_ns":1630595.061,"uttt_empty_ns":6491413.972,"uttt_mid_ns":5798305.463,"deep_chain_ns":5827060.645,"wide_512_ns":4262850.719,"uttt_rollout_ns":5099.9,"uttt_step_ns":27.772},"status":"keep","description":"Establish Criterion baseline across representative MCTS, tree, rollout, and state workloads","timestamp":1785184484660,"segment":0,"confidence":null,"asi":{"hypothesis":"A geometric mean of representative existing Criterion workloads provides broad backpressure against overfitting while full tests preserve behavior.","measurement_issue":"Hard-coded Criterion group durations override CLI measurement-time, making each loop about 82 seconds; replace only the harness with an equivalent fixed-work custom timer before optimization.","baseline_scope":["TTT empty/midgame search at 10k","UTTT empty/midgame search at 1k","deep-chain selection/backprop","wide-512 expansion/UCB","UTTT rollout","UTTT state step"]}}
{"type":"config","name":"Improve MCTS throughput and cache locality (fixed-work harness)","metricName":"geomean_ns","metricUnit":"ns","bestDirection":"lower"}
{"run":2,"commit":"f996644","metric":435340.444,"metrics":{"ttt_empty_ns":6103957.125,"ttt_mid_ns":1642766.734,"uttt_empty_ns":6468317.55,"uttt_mid_ns":5353987.95,"deep_chain_ns":5667821.458,"wide_512_ns":4244068.969,"uttt_rollout_ns":5085.923,"uttt_step_ns":30.367},"status":"keep","description":"Establish fast fixed-work baseline matching representative Criterion cases","timestamp":1785184621937,"segment":1,"confidence":null,"asi":{"hypothesis":"Batched five-round medians over the same positions and iteration counts preserve broad optimization signal while reducing loop time enough for many experiments.","measurement_design":"Pinned to CPU 0; includes four end-to-end searches, deep and wide synthetic tree shapes, UTTT rollout, and UTTT step; complete tests run outside the metric.","criterion_crosscheck":"Fixed-work medians are close to the original Criterion estimates for all large workloads; step differs slightly because nanosecond-scale harness overhead is proportionally larger."}}
{"run":3,"commit":"f996644","metric":316545.006,"metrics":{"ttt_empty_ns":3124463.583,"ttt_mid_ns":797200.219,"uttt_empty_ns":5706036.65,"uttt_mid_ns":5176349.85,"deep_chain_ns":7887545.333,"wide_512_ns":1236908.844,"uttt_rollout_ns":5021.291,"uttt_step_ns":27.97},"status":"discard","description":"Hoist parent log and score each UCB child once, but regress one-child chains","timestamp":1785184665205,"segment":1,"confidence":null,"asi":{"hypothesis":"A direct one-pass maximum can halve UCB score evaluations and hoist the parent logarithm out of wide sibling scans.","finding":"Wide-512 improved about 71% and TTT searches about 50%, confirming repeated max_by scoring and logarithms dominate wide scans.","rollback_reason":"Deep-chain selection regressed about 39% because max_by never invokes its comparator for a single child, while the replacement unnecessarily computed ln and sqrt at every chain level.","next_action_hint":"Reapply the direct scan with an immediate return when the child slice has exactly one entry; preserve the wide-path optimization."}}
{"run":4,"commit":"68548b4","metric":297085.835,"metrics":{"ttt_empty_ns":3095623.5,"ttt_mid_ns":741429.531,"uttt_empty_ns":5699241.4,"uttt_mid_ns":5143707.25,"deep_chain_ns":5431331.833,"wide_512_ns":1224112.438,"uttt_rollout_ns":5085.317,"uttt_step_ns":26.675},"status":"keep","description":"Score each UCB child once and fast-path single-child selection","timestamp":1785184694206,"segment":1,"confidence":7.10485605990102,"asi":{"hypothesis":"A direct one-pass maximum with a single-child fast path removes repeated UCB calculations without penalizing narrow trees.","result":"Primary improved 31.8%; wide-512 improved 71.2%, TTT searches 49-55%, UTTT searches 4-12%, and deep-chain improved 4.2%.","mechanism":"The scan computes each child score once and computes parent ln once; the one-child path performs no floating-point score work, matching max_by's prior behavior.","behavior_preserved":"Tie handling explicitly keeps the last equal-scoring child, matching Iterator::max_by; full tests pass."}}
{"run":5,"commit":"0512516","metric":295063.019,"metrics":{"ttt_empty_ns":2618251.958,"ttt_mid_ns":706953.719,"uttt_empty_ns":5808916.45,"uttt_mid_ns":5257973.3,"deep_chain_ns":5599531.417,"wide_512_ns":1249964.188,"uttt_rollout_ns":5798.83,"uttt_step_ns":25.039},"status":"keep","description":"Make Tic-Tac-Toe state compact and generate actions on demand","timestamp":1785184767594,"segment":1,"confidence":13.060004644821719,"asi":{"hypothesis":"Removing the cached legal-action Vec makes every Tic-Tac-Toe state allocation-free and shrinks each tree node, outweighing the cost of scanning nine squares when actions are requested.","result":"Against the previous keep, TTT empty search improved about 15.4% and midgame about 4.6%; overall geometric mean improved about 0.7% despite unrelated stochastic movement in UTTT rollout.","mechanism":"TicTacToe is now a 6-byte Copy state; step and clone no longer allocate, and nodes carry no retained action buffer.","behavior_preserved":"Legal actions are generated from the same occupied-bit test in the same order; all tests pass."}}
{"run":6,"commit":"1b203c5","metric":250978.424,"metrics":{"ttt_empty_ns":2615984.625,"ttt_mid_ns":712904.188,"uttt_empty_ns":4409393.85,"uttt_mid_ns":3959471.4,"deep_chain_ns":5484437.917,"wide_512_ns":1252538.281,"uttt_rollout_ns":4040.081,"uttt_step_ns":17.422},"status":"keep","description":"Remove retained legal-action buffers from Ultimate Tic-Tac-Toe states","timestamp":1785184837559,"segment":1,"confidence":9.474299804446977,"asi":{"hypothesis":"Representing UTTT move constraints as compact metadata instead of a retained capacity-81 Vec eliminates state clone/step allocation and materially shrinks every UTTT tree node.","result":"Against the prior keep, primary improved about 14.9%; UTTT empty/mid search improved about 24-25%, rollout 30%, and step 30%.","mechanism":"UltimateTicTacToe is now a 46-byte Copy state with next-board and occupied counters; legal actions are generated only when requested, forced-board action buffers reserve 9 rather than 81, and step performs no allocation.","behavior_preserved":"Action ordering and fallback rules remain unchanged, occupied increments only for a previously empty square, and all deterministic, invariant, and playing-strength tests pass."}}
{"run":7,"commit":"1b203c5","metric":261014.198,"metrics":{"ttt_empty_ns":2607978.917,"ttt_mid_ns":727083.328,"uttt_empty_ns":4796118.35,"uttt_mid_ns":4304941.7,"deep_chain_ns":5294599.417,"wide_512_ns":1244182.469,"uttt_rollout_ns":4497.181,"uttt_step_ns":18.574},"status":"discard","description":"Reuse one thread RNG handle throughout each search","timestamp":1785184896421,"segment":1,"confidence":6.639990543627604,"asi":{"hypothesis":"Keeping one ThreadRng handle should avoid repeated TLS handle construction in child selection and each rollout ply.","finding":"No improvement appeared in TTT or synthetic tree workloads, while both UTTT searches regressed about 8-9% against the prior keep; unmodified rollout movement confirms some noise but does not explain the full search regression.","rollback_reason":"Primary regressed about 4.0% and the production end-to-end UTTT metrics both moved materially in the wrong direction.","next_action_hint":"Leave thread_rng call structure unchanged; focus on allocation/layout and deterministic hot-loop work with stronger signals."}}
{"run":8,"commit":"e850d5d","metric":237221.706,"metrics":{"ttt_empty_ns":2603283.667,"ttt_mid_ns":724907.75,"uttt_empty_ns":3646443.8,"uttt_mid_ns":3210072.3,"deep_chain_ns":5395638.542,"wide_512_ns":1259984.312,"uttt_rollout_ns":4106.14,"uttt_step_ns":16.263},"status":"keep","description":"Select rollout actions without allocating legal-action vectors","timestamp":1785184972767,"segment":1,"confidence":5.8186666140363625,"asi":{"hypothesis":"An overridable uniformly random action method lets compact bundled states select the nth empty square directly and removes the last per-ply rollout allocation while retaining a compatible default for external State implementations.","result":"Against the prior keep, primary improved about 5.5%; UTTT empty and midgame searches improved about 17-19%. TTT was roughly flat because its action vectors are tiny.","mechanism":"Bundled states count empty bits, draw one uniform index, and scan to the nth empty cell; generic states retain the old Vec-and-choose default behavior.","behavior_preserved":"The direct selector uses the same action ordering and uniform index sampling as Vec::choose; deterministic, tree-invariant, and playing-strength tests pass."}}
{"run":9,"commit":"e850d5d","metric":237795.22,"metrics":{"ttt_empty_ns":2627042.25,"ttt_mid_ns":715560.641,"uttt_empty_ns":3609457.15,"uttt_mid_ns":3172429.1,"deep_chain_ns":5446037,"wide_512_ns":1252757.469,"uttt_rollout_ns":4096.364,"uttt_step_ns":16.995},"status":"discard","description":"Move the owned root state directly into its node","timestamp":1785185003159,"segment":1,"confidence":6.043284000986967,"asi":{"hypothesis":"Mcts::new receives an owned state, so moving it rather than cloning should reduce construction work.","finding":"With bundled states now compact and Copy, construction clone cost is below measurable noise; mixed secondary movement produced a 0.24% primary regression.","rollback_reason":"Primary did not improve, and the one-line cleanup has no meaningful effect on measured search throughput.","next_action_hint":"Focus on repeated per-iteration work rather than one-time construction after state compaction."}}
{"run":10,"commit":"e850d5d","metric":0,"metrics":{"ttt_empty_ns":0,"ttt_mid_ns":0,"uttt_empty_ns":0,"uttt_mid_ns":0,"deep_chain_ns":0,"wide_512_ns":0,"uttt_rollout_ns":0,"uttt_step_ns":0},"status":"crash","description":"Add a hot-node sidecar for selection and backpropagation","timestamp":1785185127698,"segment":1,"confidence":6.043284000986967,"asi":{"hypothesis":"Keeping parent, visits, reward sum, and q in a compact 32-byte sidecar should make selection/backprop cache-local while public Node fields can be synchronized after search.","error":"Rust could not infer the closure parameter used to index hot_nodes in get_best_child; annotate it as usize.","rollback_reason":"Compilation failed before measurement due to a trivial closure type inference error.","next_action_hint":"Reapply the same sidecar experiment with `let score = |id: usize|` and measure cache-local gains versus synchronization overhead."}}
{"run":11,"commit":"e850d5d","metric":234669.362,"metrics":{"ttt_empty_ns":2850335.542,"ttt_mid_ns":708384.953,"uttt_empty_ns":3645688.15,"uttt_mid_ns":3204176.1,"deep_chain_ns":4895515.25,"wide_512_ns":1251550.062,"uttt_rollout_ns":4127.541,"uttt_step_ns":15.419},"status":"discard","description":"Maintain compact hot-node metadata during search and sync public nodes afterward","timestamp":1785185192363,"segment":1,"confidence":7.5202114752204166,"asi":{"hypothesis":"A compact 32-byte sidecar should keep selection and backpropagation inside L1 while public Node statistics are synchronized after the search.","finding":"Deep-chain improved about 9.3%, validating the cache-local hot-set diagnosis, but wide and UTTT were flat and empty-board TTT regressed about 9.5% from sidecar growth/synchronization overhead.","rollback_reason":"The 1.1% aggregate improvement was driven by one synthetic deep-tree case and unrelated microbenchmark noise while a key end-to-end user workload regressed nearly 10%; the complexity also leaves public Node stats stale during an in-progress/panicking search.","next_action_hint":"A true hot/cold split could be valuable in a breaking API redesign that removes duplicate Node fields; avoid a duplicating sidecar under the current public representation."}}
{"run":12,"commit":"e850d5d","metric":245349.266,"metrics":{"ttt_empty_ns":2579807,"ttt_mid_ns":764240.391,"uttt_empty_ns":3911567.45,"uttt_mid_ns":3660816.1,"deep_chain_ns":5926782.625,"wide_512_ns":1229350.875,"uttt_rollout_ns":4767.095,"uttt_step_ns":13.39},"status":"discard","description":"Return the last unvisited child before computing UCB scores","timestamp":1785185231334,"segment":1,"confidence":9.880850901688255,"asi":{"hypothesis":"Because all unvisited children have infinite UCB and ties choose the last, a reverse scan can skip floating-point scoring during initial exploration and remove the n==0 branch from steady-state scoring.","finding":"Wide-512 improved only about 2.4%; end-to-end search metrics were mixed-to-worse and the aggregate regressed 3.4%. The extra full reverse pass once all children are visited likely offsets the exploration savings.","rollback_reason":"Primary regressed materially, with no broad search improvement.","next_action_hint":"Keep the single-pass branch in UCB scoring; investigate reducing arithmetic for the fully visited steady state instead."}}
{"run":13,"commit":"e850d5d","metric":0,"metrics":{"ttt_empty_ns":0,"ttt_mid_ns":0,"uttt_empty_ns":0,"uttt_mid_ns":0,"deep_chain_ns":0,"wide_512_ns":0,"uttt_rollout_ns":0,"uttt_step_ns":0},"status":"crash","description":"Reserve each expanded node's child list exactly once","timestamp":1785185256799,"segment":1,"confidence":9.880850901688255,"asi":{"hypothesis":"Reserving the known legal-action count should replace repeated child-Vec growth and avoid power-of-two over-allocation.","error":"The existing local binding explicitly typed the mutable arena lookup as `&Node<S>`, so calling reserve failed; it must be `&mut Node<S>`.","rollback_reason":"Compilation failed before measurement due to the immutable reference annotation.","next_action_hint":"Reapply with a mutable parent binding and reserve before arena growth invalidates the borrow."}}
{"run":14,"commit":"e850d5d","metric":240407.263,"metrics":{"ttt_empty_ns":2543162.292,"ttt_mid_ns":707026.094,"uttt_empty_ns":3535522,"uttt_mid_ns":3103974.9,"deep_chain_ns":5914943.208,"wide_512_ns":1339649.844,"uttt_rollout_ns":4593.297,"uttt_step_ns":15.536},"status":"discard","description":"Reserve child vectors using the known legal-action count","timestamp":1785185288961,"segment":1,"confidence":14.401599131420744,"asi":{"hypothesis":"Expansion already knows the final child count, so exact reserve should avoid repeated reallocations and excess child-list capacity.","finding":"End-to-end TTT empty and UTTT searches improved roughly 2-3%, but both synthetic tree workloads regressed 6-10% and aggregate worsened 1.3%. Exact tiny allocations may interact worse with allocator size classes than Vec's default minimum capacity.","rollback_reason":"Primary regressed and the intended allocator improvement was not broad across generic tree shapes.","next_action_hint":"Consider arena-level capacity planning separately; do not exact-reserve every per-node Vec, especially one-child nodes."}}
{"run":15,"commit":"e850d5d","metric":239812.177,"metrics":{"ttt_empty_ns":2565089.25,"ttt_mid_ns":717780.547,"uttt_empty_ns":3596368.65,"uttt_mid_ns":3167124.5,"deep_chain_ns":5437820.167,"wide_512_ns":1244927.656,"uttt_rollout_ns":4061.556,"uttt_step_ns":18.971},"status":"discard","description":"Reserve at least one arena slot per requested search iteration","timestamp":1785185319655,"segment":1,"confidence":16.653887116994724,"asi":{"hypothesis":"Every active search generally creates at least one node per iteration, so reserving n arena slots should reduce whole-arena reallocations and copies.","finding":"Search workloads moved only about 0-2% and aggregate regressed 1.1%; UTTT still creates far more than n nodes while terminal-depth synthetic games may create fewer, making n a weak generic estimate.","rollback_reason":"Primary did not improve and the extra up-front memory commitment lacks a robust throughput win.","next_action_hint":"Avoid generic reserve heuristics based only on iteration count; allocation reduction needs structural child/state changes or workload-aware API input."}}
{"run":16,"commit":"b39ab1b","metric":231049.395,"metrics":{"ttt_empty_ns":2417074.375,"ttt_mid_ns":598471.188,"uttt_empty_ns":3643197.85,"uttt_mid_ns":3197351.8,"deep_chain_ns":5400620.083,"wide_512_ns":1249961.719,"uttt_rollout_ns":4080.878,"uttt_step_ns":17.496},"status":"keep","description":"Use a compact lookup table for Tic-Tac-Toe win detection","timestamp":1785185358293,"segment":1,"confidence":19.12854731653017,"asi":{"hypothesis":"A 512-entry table can replace eight mask comparisons for every Tic-Tac-Toe terminal and reward check while remaining resident in L1.","result":"Against the prior keep, primary improved about 2.6%; TTT empty search improved 7.2% and midgame 17.4%, with unrelated workloads flat.","mechanism":"All possible 9-bit boards are evaluated at compile time into a 512-byte boolean table, reducing win detection to one indexed load.","behavior_preserved":"The table is generated from the exact existing WIN_PATTERNS and all tests pass."}}
{"run":17,"commit":"faa08fb","metric":225351.761,"metrics":{"ttt_empty_ns":2433511.792,"ttt_mid_ns":602375.703,"uttt_empty_ns":3522986.15,"uttt_mid_ns":3096210,"deep_chain_ns":5346842.125,"wide_512_ns":1233121.844,"uttt_rollout_ns":4035.968,"uttt_step_ns":15.631},"status":"keep","description":"Use lookup-based win detection in Ultimate Tic-Tac-Toe","timestamp":1785185398151,"segment":1,"confidence":20.959284595113672,"asi":{"hypothesis":"The same 9-bit win table can accelerate both macro-board terminal checks and mini-board updates throughout UTTT playouts.","result":"Against the prior keep, primary improved about 2.5%; UTTT search improved about 3.2%, state step 10.7%, and the other workloads stayed effectively flat.","mechanism":"Macro and mini board wins now use indexed loads into a 512-byte compile-time table rather than scanning eight patterns.","behavior_preserved":"The table derives from the original patterns and update priority remains X before O; all tests pass."}}
{"run":18,"commit":"faa08fb","metric":228513.758,"metrics":{"ttt_empty_ns":2401409.125,"ttt_mid_ns":620360.594,"uttt_empty_ns":3455891.7,"uttt_mid_ns":3013048.1,"deep_chain_ns":5389871.042,"wide_512_ns":1239430.875,"uttt_rollout_ns":4071.923,"uttt_step_ns":17.621},"status":"discard","description":"Use the maintained occupied count when sampling unrestricted UTTT moves","timestamp":1785185423874,"segment":1,"confidence":19.86429711930413,"asi":{"hypothesis":"The exact occupied counter can replace nine popcounts when choosing uniformly from an unrestricted UTTT position.","finding":"Both targeted end-to-end UTTT searches improved about 2-3%, but unrelated TTT/step noise moved the aggregate 1.4% worse.","rollback_reason":"Primary metric regressed under the fixed aggregate despite favorable targeted metrics; the expected gain is small enough to require confirmation.","next_action_hint":"Optionally remeasure this one-line change for confirmation, or pursue larger deterministic savings in action generation."}}
{"run":19,"commit":"faa08fb","metric":233398.812,"metrics":{"ttt_empty_ns":2615286.458,"ttt_mid_ns":670386.969,"uttt_empty_ns":3351712.4,"uttt_mid_ns":2989816.75,"deep_chain_ns":5622202.875,"wide_512_ns":1302923.906,"uttt_rollout_ns":4189.896,"uttt_step_ns":16.331},"status":"discard","description":"Update only the moving player's UTTT mini-board win status","timestamp":1785185466126,"segment":1,"confidence":21.073649197861062,"asi":{"hypothesis":"Only the moving player can create a new mini-board win, so step can avoid checking both boards while retaining X-first handling for already-won boards.","finding":"UTTT end-to-end searches improved about 3-5%, but the direct step microbenchmark did not improve and broad aggregate regressed 3.6%; unrelated workloads also shifted slower together, suggesting a noisy run but no strong isolated hot-path signal.","rollback_reason":"Primary regressed materially and the more subtle won-board semantics are not justified without a clear direct-step gain.","next_action_hint":"Keep the simple shared macro update; seek transformations with larger signal or improve measurement stability before revisiting."}}
{"run":20,"commit":"faa08fb","metric":221263.046,"metrics":{"ttt_empty_ns":2441844.708,"ttt_mid_ns":605329.125,"uttt_empty_ns":3497218.95,"uttt_mid_ns":3076104.2,"deep_chain_ns":5361551.292,"wide_512_ns":1242549,"uttt_rollout_ns":4050.054,"uttt_step_ns":13.39},"status":"discard","description":"Enumerate empty Tic-Tac-Toe squares with trailing-zero bit scans","timestamp":1785185501735,"segment":1,"confidence":18.805663442694755,"asi":{"hypothesis":"Iterating set bits should remove nine occupancy branches while preserving ascending legal-action order.","finding":"Both directly affected TTT search workloads were flat-to-slightly worse; the apparent 1.8% aggregate gain came from an unrelated UTTT step code-layout swing, not the changed action generator.","rollback_reason":"Keeping this would overfit measurement noise: no targeted workload improved, so the primary movement lacks a causal performance signal.","next_action_hint":"Retain the simple fixed nine-cell loop for TTT; bit iteration may be more valuable in UTTT fallback scans spanning 81 cells."}}
