{"run":21,"commit":"7e048f6","metric":221096.341,"metrics":{"ttt_empty_ns":2463487.125,"ttt_mid_ns":607129.297,"uttt_empty_ns":3542063.2,"uttt_mid_ns":3102486.1,"deep_chain_ns":5375053.333,"wide_512_ns":1247853.312,"uttt_rollout_ns":3830.261,"uttt_step_ns":13.523},"status":"keep","description":"Enumerate UTTT legal actions from empty-bit masks","timestamp":1785185532758,"segment":1,"confidence":19.073873878205006,"asi":{"hypothesis":"UTTT action generation can preserve ascending order while replacing up to 81 branchy occupancy tests with trailing-zero iteration over nine 9-bit empty masks.","result":"Primary improved about 1.9%; the directly affected external rollout improved about 5.1%, while end-to-end search remained within roughly 0.6% because production rollouts already use the allocation-free random selector.","mechanism":"Each mini-board computes its empty mask once and uses trailing_zeros plus clear-lowest-bit to emit only legal cells.","behavior_preserved":"Board and cell traversal remain ascending, so legal-action ordering is unchanged; all tests pass."}}
{"run":22,"commit":"7e048f6","metric":224157.291,"metrics":{"ttt_empty_ns":2909370.458,"ttt_mid_ns":946563.453,"uttt_empty_ns":2766162.3,"uttt_mid_ns":2389639.75,"deep_chain_ns":5427298.042,"wide_512_ns":1240767.75,"uttt_rollout_ns":3845.563,"uttt_step_ns":13.522},"status":"discard","description":"Select the nth empty UTTT bit without branch-scanning cells","timestamp":1785185596590,"segment":1,"confidence":17.21740739451948,"asi":{"hypothesis":"Choose a board by popcount and the nth set bit within it to replace up to 81 branchy per-cell tests in every production rollout move.","finding":"The targeted UTTT search workloads improved a very large 22-23%, but unrelated TTT search regressed 18-56%, leaving primary 1.4% worse. Such cross-workload movement from UTTT-only code indicates a noisy/code-layout outlier requiring confirmation.","rollback_reason":"Primary regressed and broad results were internally inconsistent despite a highly promising targeted signal.","next_action_hint":"Reapply and rerun the exact change; keep only if the UTTT gain repeats without catastrophic unrelated regressions. Consider `#[inline(never)]` or a smaller selector helper if code size perturbs layout."}}
{"run":23,"commit":"6b1b043","metric":205184.905,"metrics":{"ttt_empty_ns":2413285.375,"ttt_mid_ns":602193.078,"uttt_empty_ns":2763565.35,"uttt_mid_ns":2384952.35,"deep_chain_ns":5341165.708,"wide_512_ns":1244327.438,"uttt_rollout_ns":3815.859,"uttt_step_ns":12.933},"status":"keep","description":"Select random UTTT moves by board popcount and nth set bit","timestamp":1785185636367,"segment":1,"confidence":18.045842550421895,"asi":{"hypothesis":"Board-level popcounts plus nth-set-bit selection remove branch-scanning across cells from every UTTT rollout move.","result":"Confirmation repeated the 22-23% UTTT search gains while unrelated workloads returned to baseline; primary improved 7.2% against the prior keep.","mechanism":"Forced moves select directly from one empty mask; unrestricted moves subtract per-board popcounts, then clear low bits to the sampled position instead of testing cells one by one.","behavior_preserved":"Sampling remains uniform over the same ordered legal set; all tests pass. A first noisy run showed the same UTTT gain but unrelated TTT regressions, so this keep is based on the clean confirmation."}}
{"run":24,"commit":"6b1b043","metric":209234.912,"metrics":{"ttt_empty_ns":2407946.25,"ttt_mid_ns":602786.344,"uttt_empty_ns":2766355.85,"uttt_mid_ns":2391764.8,"deep_chain_ns":5479623.583,"wide_512_ns":1245066.812,"uttt_rollout_ns":3792.997,"uttt_step_ns":14.781},"status":"discard","description":"Select random Tic-Tac-Toe moves by nth set bit","timestamp":1785185671202,"segment":1,"confidence":17.616980094401463,"asi":{"hypothesis":"The UTTT nth-set-bit win might transfer to compact Tic-Tac-Toe rollout selection.","finding":"Both targeted TTT searches were effectively unchanged; scanning at most nine cells is already cheap and the helper adds no measurable value.","rollback_reason":"Primary regressed about 2.0% due unrelated metric movement and targeted workloads did not improve.","next_action_hint":"Keep the straightforward nine-cell TTT selector; nth-set-bit selection pays off only for UTTT's wider unrestricted action space."}}
{"run":25,"commit":"6b1b043","metric":205754.037,"metrics":{"ttt_empty_ns":2411946.667,"ttt_mid_ns":598861.703,"uttt_empty_ns":2720950.15,"uttt_mid_ns":2363701.5,"deep_chain_ns":5386283.792,"wide_512_ns":1235596.562,"uttt_rollout_ns":3828.564,"uttt_step_ns":13.57},"status":"discard","description":"Use UTTT occupied count to bound unrestricted random selection","timestamp":1785185696951,"segment":1,"confidence":17.389435826309462,"asi":{"hypothesis":"The exact occupied counter removes an initial nine-board popcount pass before nth-set-bit random move selection.","finding":"Targeted UTTT searches improved about 1-1.5%, repeating the direction seen in an earlier selector version, but primary was 0.28% worse and therefore inside aggregate noise.","rollback_reason":"The primary metric did not improve; this small isolated saving is below reliable aggregate resolution.","next_action_hint":"The occupied-count shortcut is semantically sound and may be folded into a future larger UTTT selector change, but do not keep it alone without a confirmed primary win."}}
{"run":26,"commit":"6b1b043","metric":206369.208,"metrics":{"ttt_empty_ns":2466455.458,"ttt_mid_ns":610579.891,"uttt_empty_ns":2761472.4,"uttt_mid_ns":2382884.4,"deep_chain_ns":5308350.167,"wide_512_ns":1210058.625,"uttt_rollout_ns":3846.173,"uttt_step_ns":13.437},"status":"discard","description":"Scan contiguous child nodes directly during UCB selection","timestamp":1785185734023,"segment":1,"confidence":17.167694614985965,"asi":{"hypothesis":"Expansion creates contiguous child IDs, so slicing arena nodes should remove child-ID loads and repeated bounds checks while exposing a sequential scan to the optimizer.","finding":"Wide-512 improved about 2.8%, but end-to-end TTT regressed 2-2.5% and primary worsened 0.6%; AoS node stride remains the dominant limitation, so removing ID indirection is minor.","rollback_reason":"Primary did not improve, and assuming contiguity inside the public Node method narrows behavior for manually constructed public arenas without a broad win.","next_action_hint":"The verified contiguity invariant is only worthwhile if paired with a breaking child-range/hot-cold layout redesign."}}
{"run":27,"commit":"6b1b043","metric":207798.652,"metrics":{"ttt_empty_ns":2475876.292,"ttt_mid_ns":618872.188,"uttt_empty_ns":2797178.65,"uttt_mid_ns":2428280.55,"deep_chain_ns":5388209.25,"wide_512_ns":1226218.844,"uttt_rollout_ns":3793.194,"uttt_step_ns":13.328},"status":"discard","description":"Hoist the parent square root and exploration multiplier from UCB scans","timestamp":1785185764279,"segment":1,"confidence":17.904815112436065,"asi":{"hypothesis":"Algebraically rewriting c*sqrt(log(parent)/n) as (c*sqrt(log(parent)))/sqrt(n) should hoist one multiply and parent work from each child score.","finding":"Wide-512 improved only about 1.4%, while all four end-to-end searches regressed 1-3% and primary worsened 1.3%. Hardware still performs one sqrt per child and the division/multiply substitution is not cheaper overall.","rollback_reason":"Primary regressed and changed floating-point rounding offers no compensating broad speedup.","next_action_hint":"Leave the exact UCB arithmetic form established by the large one-pass scoring win; further scalar algebra has little headroom."}}
{"run":28,"commit":"6b1b043","metric":206867.201,"metrics":{"ttt_empty_ns":2448028.125,"ttt_mid_ns":626080.422,"uttt_empty_ns":2757086.95,"uttt_mid_ns":2394259.35,"deep_chain_ns":5346183.333,"wide_512_ns":1230794.75,"uttt_rollout_ns":3797.313,"uttt_step_ns":13.267},"status":"discard","description":"Reuse one legal-action buffer across tree expansions","timestamp":1785185868836,"segment":1,"confidence":18.70807409340771,"asi":{"hypothesis":"An optional append-into API and Mcts-owned scratch Vec should eliminate one temporary action allocation per expanded node for optimized states without breaking existing State implementations.","finding":"UTTT and synthetic workloads were flat while TTT searches regressed 1-4%; retaining and borrowing the scratch buffer adds enough overhead to offset allocator savings after compact-state optimizations.","rollback_reason":"Primary regressed 0.8% and no directly affected end-to-end workload improved.","next_action_hint":"Do not expand the public State API for action-buffer reuse under the current design; per-node children allocations and UCB/state work dominate the remaining temporary action Vec."}}
{"run":29,"commit":"6b1b043","metric":209019.911,"metrics":{"ttt_empty_ns":2463457.042,"ttt_mid_ns":646308.844,"uttt_empty_ns":2754161.6,"uttt_mid_ns":2401817.5,"deep_chain_ns":5446852.542,"wide_512_ns":1253140.719,"uttt_rollout_ns":3783.06,"uttt_step_ns":13.397},"status":"discard","description":"Score each root child once when choosing the final action","timestamp":1785185909262,"segment":1,"confidence":14.439101098345915,"asi":{"hypothesis":"The final max_by repeats running-best q loads just like the formerly expensive UCB scan, so a direct one-pass maximum may reduce work.","finding":"Final selection happens only once per whole search; no workload improved and TTT midgame regressed enough to move primary 1.9% worse.","rollback_reason":"Primary regressed and the optimization targets negligible amortized work at current search budgets.","next_action_hint":"Do not spend complexity on final action selection; optimize repeated selection, expansion, simulation, or backprop loops."}}
{"run":30,"commit":"6b1b043","metric":209861.413,"metrics":{"ttt_empty_ns":2506539.458,"ttt_mid_ns":614415.031,"uttt_empty_ns":2584880.7,"uttt_mid_ns":2234582.15,"deep_chain_ns":5454995.25,"wide_512_ns":1255075.531,"uttt_rollout_ns":3867.745,"uttt_step_ns":15.972},"status":"discard","description":"Hint UTTT step for cross-crate inlining into simulations","timestamp":1785185975744,"segment":1,"confidence":11.548758296252162,"asi":{"hypothesis":"UTTT step remains an out-of-line symbol in the release benchmark; exposing it for inlining into generic simulation should remove one call per rollout ply and enable state optimization.","finding":"End-to-end UTTT searches improved a strong 6-7%, but direct UTTT step regressed about 23% and unrelated workloads also slowed, producing a 2.3% primary regression. Inlining increases code size and has a real micro-path tradeoff.","rollback_reason":"Primary regressed and the direct public step path degraded substantially, so the search-only gain is not broad enough.","next_action_hint":"Keep UTTT step out of line unless the simulation loop is specialized in a way that avoids globally forcing larger caller code."}}
{"run":31,"commit":"6b1b043","metric":206638.873,"metrics":{"ttt_empty_ns":2429972.667,"ttt_mid_ns":606638.484,"uttt_empty_ns":2765294.6,"uttt_mid_ns":2403678.6,"deep_chain_ns":5486687.708,"wide_512_ns":1252132.688,"uttt_rollout_ns":3856.211,"uttt_step_ns":12.806},"status":"discard","description":"Hint UTTT random-action selection for cross-crate inlining","timestamp":1785186000165,"segment":1,"confidence":11.375022475198705,"asi":{"hypothesis":"Inlining allocation-free UTTT action selection into simulation may expose bitmask work and avoid one call per rollout ply.","finding":"Targeted UTTT searches were flat-to-slightly worse and primary regressed 0.7%; the selector is about 1.5 KiB of machine code and not a good inline candidate.","rollback_reason":"Primary did not improve and no target metric showed a causal gain.","next_action_hint":"Leave the large random selector out of line; reduce its code/branches first rather than forcing inlining."}}
{"run":32,"commit":"6b1b043","metric":209527.771,"metrics":{"ttt_empty_ns":2420656.792,"ttt_mid_ns":609142.984,"uttt_empty_ns":2827584.15,"uttt_mid_ns":2451268.25,"deep_chain_ns":5505615.292,"wide_512_ns":1261582.906,"uttt_rollout_ns":3870.069,"uttt_step_ns":13.522},"status":"discard","description":"Hint TTT random-action selection for cross-crate inlining","timestamp":1785186025382,"segment":1,"confidence":12.122390002689883,"asi":{"hypothesis":"The smaller TTT random selector might be a viable inline candidate even though UTTT's larger selector was not.","finding":"TTT searches remained flat and all unrelated large workloads drifted slower; primary regressed 2.1%. The call is not the bottleneck after compact bitboard selection.","rollback_reason":"Primary regressed and targeted metrics did not improve.","next_action_hint":"Avoid further manual inline hints; current compiler call boundaries are preferable for instruction-cache locality."}}
{"run":33,"commit":"d5fadbd","metric":174806.804,"metrics":{"ttt_empty_ns":1901491.458,"ttt_mid_ns":485034.047,"uttt_empty_ns":2611639.8,"uttt_mid_ns":2362415.7,"deep_chain_ns":5335129.333,"wide_512_ns":574250.062,"uttt_rollout_ns":3740.999,"uttt_step_ns":13.369},"status":"keep","description":"Cache inverse square roots for repeated UCB child scoring","timestamp":1785186194574,"segment":1,"confidence":14.632325074466404,"asi":{"hypothesis":"Child visit counts repeat across millions of UCB scores, so a bounded inverse-sqrt table can replace per-child floating division and sqrt with one cache-resident load and multiply.","result":"Against the prior keep, primary improved 14.8%; wide-512 improved 53.8%, TTT searches about 20-21%, UTTT empty 5.5%, and deep-chain stayed flat due its single-child fast path.","mechanism":"Each search extends a per-Mcts lookup only to the required visit budget, capped at 16,384 entries (128 KiB); parent sqrt/log are computed once per scan and larger counts retain a scalar fallback.","tradeoff":"UCB arithmetic is algebraically equivalent but may round in a different final bit; tie order remains last-equal and all exact invariants and behavioral tests pass."}}
{"run":34,"commit":"cf569bd","metric":171538,"metrics":{"ttt_empty_ns":1899251.333,"ttt_mid_ns":476966.266,"uttt_empty_ns":2558078.95,"uttt_mid_ns":2306574.45,"deep_chain_ns":5303491.375,"wide_512_ns":534338.75,"uttt_rollout_ns":3717.276,"uttt_step_ns":13.315},"status":"keep","description":"Cover the full search budget with branch-free UCB lookup","timestamp":1785186239191,"segment":1,"confidence":16.152636963969172,"asi":{"hypothesis":"Every child visit count is bounded by final root visits, so sizing inverse-sqrt storage to the full requested budget removes the per-child cache-range branch and scalar fallback.","result":"Against the prior keep, primary improved 1.9%; wide-512 improved 7.0%, UTTT searches 2-2.5%, and other workloads were flat-to-better.","mechanism":"The lookup now has exactly total-root-budget coverage, making every visited-child score one q load, one lookup, and one multiply. Memory cost is 8 bytes per cumulative search iteration, small relative to at least one tree node per active iteration in branching workloads.","invariant":"After extension, `child.n <= root.n + requested_iterations`, so indexing is safe; repeated search calls extend from the existing table. Full tests pass."}}
{"run":35,"commit":"5f6bffc","metric":164268.48,"metrics":{"ttt_empty_ns":1541844.208,"ttt_mid_ns":307829.906,"uttt_empty_ns":2729872.4,"uttt_mid_ns":2463431.45,"deep_chain_ns":5540243.917,"wide_512_ns":518691,"uttt_rollout_ns":3855.868,"uttt_step_ns":14.991},"status":"keep","description":"Cache square-root logarithms for parent UCB factors","timestamp":1785186288400,"segment":1,"confidence":16.584148618884214,"asi":{"hypothesis":"Parent visit counts also repeat across deeper nodes, so precomputing sqrt(ln(n)) once per visit count can remove libm log and sqrt calls from every multi-child selection.","result":"Primary improved 4.2%; TTT empty/midgame improved 19%/35% and wide-512 2.9%. UTTT and deep-chain regressed 4-7%, likely from a second per-search table allocation/build where state or single-child work dominates.","mechanism":"A second budget-sized lookup supplies the parent exploration factor; child scoring now contains no transcendental operations for covered visits.","tradeoff":"This is a broad aggregate win but creates a measurable state-heavy workload tradeoff; next experiments should retain cached factors while reducing eager build/allocation overhead."}}
{"run":36,"commit":"5f6bffc","metric":165755.904,"metrics":{"ttt_empty_ns":1635349.042,"ttt_mid_ns":379273.844,"uttt_empty_ns":2636903.8,"uttt_mid_ns":2361600.95,"deep_chain_ns":5400057,"wide_512_ns":535523.062,"uttt_rollout_ns":3761.395,"uttt_step_ns":13.563},"status":"discard","description":"Populate parent exploration factors lazily on first use","timestamp":1785186330752,"segment":1,"confidence":16.57056947096883,"asi":{"hypothesis":"Resizing with NaNs and computing sqrt(log(n)) only for parent counts actually selected should remove wasted setup for single-child/state-heavy trees.","finding":"Deep-chain and UTTT recovered 2.5-4%, but TTT lost 6-23% and wide lost 3.2% versus eager caching. The per-selection NaN branch/write and loss of sequential precompute/cache warming outweigh skipped values in multi-child trees.","rollback_reason":"Primary regressed 0.9%; eager branch-free factor lookup remains better for the aggregate workload.","next_action_hint":"Keep eager sequential sqrt-log construction; if reducing state-heavy overhead, share precomputed tables rather than adding a hot-path validity branch."}}
{"run":37,"commit":"4f4d63e","metric":162681.591,"metrics":{"ttt_empty_ns":1574373.875,"ttt_mid_ns":304059.578,"uttt_empty_ns":2653039.6,"uttt_mid_ns":2389725.15,"deep_chain_ns":5413071.625,"wide_512_ns":514205.969,"uttt_rollout_ns":3803.31,"uttt_step_ns":15.269},"status":"keep","description":"Build UCB lookup tables only after a branching expansion","timestamp":1785186397635,"segment":1,"confidence":16.824429191229395,"asi":{"hypothesis":"A tree whose every node has one child never scores UCB, so defer eager lookup construction until expansion actually creates siblings.","result":"Primary improved 1.0%; deep-chain recovered 2.3%, UTTT searches improved about 3%, TTT midgame and wide improved about 1%, with only TTT empty moving 2% worse.","mechanism":"The first multi-child expansion builds both full-budget tables before they can be indexed; single-child trees retain the fast path and never allocate or calculate table entries.","invariant":"On repeated searches, prior tables cover all pre-existing visit counts; any newly expanded branching node extends them to the new total budget before subsequent selection. Tests pass."}}
{"run":38,"commit":"84b8579","metric":161647.806,"metrics":{"ttt_empty_ns":1568577.208,"ttt_mid_ns":302216.766,"uttt_empty_ns":2639949.05,"uttt_mid_ns":2385200.6,"deep_chain_ns":5391302.125,"wide_512_ns":514959.719,"uttt_rollout_ns":3822.643,"uttt_step_ns":14.716},"status":"keep","description":"Track UCB cache readiness once per search","timestamp":1785186430234,"segment":1,"confidence":17.150101449620454,"asi":{"hypothesis":"After the first branching expansion prepares full-budget UCB tables, a local readiness flag avoids reloading Vec length and comparing the budget on every later expansion.","result":"Primary improved 0.64%; all four end-to-end searches and deep-chain improved 0.2-0.6%, while wide was effectively flat.","mechanism":"The cache-size condition is evaluated once at search entry and flipped once after construction; later expansions execute one predictable boolean check.","confidence_note":"Small but directionally consistent across affected search workloads; full tests pass."}}
{"run":39,"commit":"b1a4481","metric":159625.487,"metrics":{"ttt_empty_ns":1581569.167,"ttt_mid_ns":322362.578,"uttt_empty_ns":2589187.8,"uttt_mid_ns":2300926.05,"deep_chain_ns":5302920.333,"wide_512_ns":520969.344,"uttt_rollout_ns":3868.512,"uttt_step_ns":12.985},"status":"keep","description":"Gate parent-factor precompute by search length or branch width","timestamp":1785186493137,"segment":1,"confidence":17.212390026082815,"asi":{"hypothesis":"Eager sqrt-log factors help long/deep or very wide selection but hurt shorter state-heavy searches, so apply a generic amortization threshold while always caching per-child inverse roots.","result":"Primary improved 1.25%; UTTT searches improved 2-3.5% and deep-chain 1.6%, while TTT empty was flat and midgame regressed 6.7%; wide moved 1.2% worse.","mechanism":"Factor tables are eagerly built only for cumulative budgets >=4096 or a branching expansion >=256; otherwise parent factors use scalar ln/sqrt while child factors remain lookup-based.","tradeoff":"This retains the large long-search TTT cache benefit and recovers state-heavy UTTT overhead, but the thresholds are a cost-model heuristic that should be validated on broader Criterion/full-game runs."}}
